Post_Text,Emotions
i would lie in bed and feel it somehow sparkle and i knew that even if most meningiomas are benign mine was growing and needed to come out sooner rather than later,joy
i would love to open up a beauty salon for real women one day somewhere those who do not necessarily have perfect bodies skin can come without feeling intimidated,fear
i feel as devastated as i do right now i cannot imagine how her family feels,sadness
i do think about certain people i feel a bit disheartened about how things have turned out between them it all seems shallow and really just plain bitchy,sadness
i feel its been very successful in doing that,joy
i want to share what happened when i asked my sister why all these bad things had been raining down on me because in truth i was feeling very low,sadness
i knew just the thing he needed what every guy needs when he s feeling overwhelmed james bond,fear
i guess i could say i was feeling pretty shitty like all the feelings ive suppressed from truc were starting to arise,sadness
i am feeling a little disheartened,sadness
i didn t feel accepted,joy
i like to eat chinese food to celebrate being with friends and french food when i m feeling romantic,love
i feeling soo agitated,fear
i was a little worried about telling her the thing about voldemort but i know how id feel if i still liked someone and they started dating someone else,love
i feel thrilled when one of the students signs up on facebook and manages to locate me when it was just a few months ago we started computer lessons at the school,joy
i cannot help but feel insulted that my master did not see the need to greet me upon my waking,anger
i feel so respected now,joy
i was feeling ignored lied to full half or no truth omission avoidance being left out on things as if this was just a game to you and as if you really did not want me around,sadness
i didn t feel abused and quite honestly it made my day a little better,sadness
i feel unusually mellow not having to worry about any of the aforementioned things not having to rely on tylenol pm or nyquil to lull me to sleep,joy
i bike back to my neighborhood and stop by a mall near my house and pick up a rmb tool set and take my monitor apart lcd wireless card bluetooth card isight camera so that i can bring them just the monitor casing heh i m feeling clever at this point,joy
i told my baby to kick or move so that daddy can feel you like i always do and of course my cute little cupcake did as i told and hubby woke up from his sleep and we just laughed,joy
i have a good feeling about im determined to make it the year i succeed,joy
i always feel scared when i see a cop instead of feeling safe,fear
i could make just one person feel loved for just a mere moment then my job here on earth has been fulfilled,love
i feel like a failure at parenting and each time one of the boys screams at me talks back to be or just blatantly disregards me i am convinced ive lost the battle,joy
i believe a publisher editor should bless his products with as light a hand as is possible and i feel that having my artwork on any of my chapbooks would strike one as being a little self aggrandisement and vain,sadness
i feel better without it,joy
i made her feel like crap and i said i hated her and i stopped loving her before the summer because shes never home anymore,anger
i do know that when i see the colour purple it makes me feel calm,joy
i still feel like the debate was vicious on both sides,anger
i feel i should make is how surprised but entertained i was by the inclusion of so many popular culture and gaming references in the story mode of the game,surprise
i do feel stressed i have a bunch of tools in my pocket to fight back with,anger
i feel like i want to hide away amp be distracted at the same time,anger
im watching my sodium which mostly means im feeling stunned and overwhelmed at how much is in everything we eat,surprise
i feel that he was being overshadowed by the supporting characters,love
i don t feel all that romantic,love
i find myself trying to discreetly smell his breath but then feel guilty for being so suspicious,sadness
i am sure im not alone when i say i am feeling drained from the events of the past week,sadness
i am still setting myself the challenge of painting roses in a way that i feel i am capturing their beauty and sweet perfume,joy
i feel strongly that by supporting because i am a girl we can have a positive impact on girls both on and off the soccer field said christine sinclair captain canadian women s national team,joy
i love this song and it always makes me feel happy,joy
i do feel that being the wife mother submissive that i am are all tied together i am not offended by the idea that i am submissive to my children,sadness
i forgive stanley hes not so quick to forgive as well and accuses me of making a foolish mistake and making him feel unwelcome in our apt,sadness
i often feel dissatisfied when i don t have at least one project going on,anger
i suppose it all goes along with feeling unwelcome and mostly being shunned,sadness
i still didnt feel satisfied with and about myself,joy
i want that feeling that someone is devoted to me and wants to keep me strong and go through things with me,love
i feel we have ignored the talents achievements and skills our our female politicians instead seeking moreso than male politicians to concentrate on their pasts,sadness
i was doing okay even done some enclosed seams and was feeling quite proud of myself until i realised id done the seams too big,joy
i feel a tad bit envious of my younger self i was in great running shape young and had my whole life ahead of me,anger
i didnt want to feel outcasted as the uptight religious mormon girl nor did i want to feel like i had to remind everyone i did not drink smoke or wear short dresses,fear
i have been given appointments with oncologists and radiologists per protocol following breast cancer surgery i have to admit that i feel strange,fear
i actually just took a two hour break because i was feeling too pissed to keep writing,anger
im feeling happy sad or angry,joy
im feeling a little tender and mashed today and im doing my best,love
i feel as though i am boring or a bit dull because it is hard to keep up with her energy and i do not want her to get the wrong impression,sadness
i feel like i m going to become sleep deprived even though there s only two days left of going to school,sadness
i am feeling wonderful filled with hope and faith,joy
i know she feels helpless but that kiss that cuddle the hug every morning and the love you every night,sadness
i don t know if it s normal to feel cranky and weepy at this stage of my pregnancy but lately i ve been feeling really sad and disappointed for not giving birth last weekend after i felt that i was having labor pains early friday morning until the morning of saturday,anger
i feel freaking fantastic this morning,joy
i feel is most important and an issue often glossed over in education and clinical training is the mental health of the therapist,joy
i wish there was something like this when i was younger i had a hard time asking questions without feeling embarrassed or awkward,sadness
i will never forget as he shot the dye into me telling me ok youre going to feel a hot flash and then it will feel like youve pissed yourself,love
i feel it my solemn duty to warn you,joy
i feel thats the most tragic human trait,sadness
i feel suck mad and sad,anger
i feel little impatient especially thinking of who the scoundrel will be coming to impose his her their will on me,anger
i generally refrain from putting friends bands up here mostly because i feel pretty goddamn weird about it but fuck it,fear
i feel a bit bitchy today lt take a look its free and it doesnt concern you so i was reading the critics for mamma mia,anger
i did a sketch of mikala and started working on panel four but im feeling particularly drained tonight,sadness
i feel a positive responsibility to see this through to reward our efforts and to make sure were all proud of the end result,joy
i slipped out feeling a bit shaken,fear
i wasnt feeling well so we had to cancel our plans to join a larger family gathering,joy
im not really feeling so whiney,sadness
i feel a bit rude leaving you hanging there from my last post with an almost done room and then radio silence,anger
i have this mixed up kinda feeling and i really feel unimportant to the people around me,sadness
i was feeling somewhat shaky and i know that i was experiencing the onset of the infamous bonk,fear
i woke up this morning feeling hopeful and energetic,joy
i would feel i missed out on a wealth of treasures if i did not read,sadness
i have tried to live a good honest life and yet it feels like im being punished,sadness
i feel that perfume ought to last all day long and never having to reapply which is certainly not the case with dorothy jessica parker s lovely,love
i walked out of there an hour and fifteen minutes later feeling like i had been beaten with a stick and then placed on the rack and stretched,sadness
im feeling confident about it,joy
i feel blessed that i am allowed to take things for granted,joy
i feel no bitter feelings for the fans that drove me out of the fandom anymore either,anger
i feel idiotic but now my friends and family are going to make fun of me for it and now that i thought i had a good reason to be proud this shit happens,sadness
i felt a sense of relief that i could feel again even though it was unpleasant,sadness
i wasn t sure what prompted the thought since i m feeling so blessed these days and the idea of giving up hasn t been a part of my thought process and rarely is in as long as i can remember,love
i have a job where i am needed and where i am missed when i go away and its not just the things that i do that are missed but me as a person and that feels amazing,joy
i don t always feel quite as graceful but that s a story for another time,joy
i cant help to also feel a little restless,fear
i cannot wait for school to end so i can change into a tank top and shorts and head to the gym and then to release my toxins and stretch and realize that homework is important but feeling good is even better,joy
i believe that im love i believe that youre love i believe that all life experiences and emotions are inspired by and exist as love even experiences and emotions which feel fearful,fear
i started feeling funny last monday i just knew i was pregnant,surprise
i spent the last two weeks feeling very afraid,fear
i feel very very rich and fulfilled and a part of the grand scheme of the universe,joy
im not feeling very graceful today,joy
i concluded that if my wife cheated on me with a man i would feel betrayed and devastated and my trust in her would plummet,sadness
i have now synced it with my itunes and feel delighted that music will be more accessible to me no matter where i am and can once again feature heavily in my life,joy
i dolphins feel sweet taste of victory defeat cincinnati bengals in overtime a href http twitter,joy
im feeling a little giggly here,joy
i feel like i should also mention that there was some content that i wasnt thrilled with either,joy
i obviously wasn t feeling particularly friendly and neither was i but we said yes anyway,joy
i feel like i just don t want to be bothered i just listen to music,anger
i feel bitter about me being like this but then i really am not,anger
i have i feel pathetic for lying if i say no,sadness
i left the game feeling a little devastated and sat contemplating my choices for some time afterwards,sadness
i spent a lot of time feeling overwhelmed with the amount of information he provided while reading the textbook,fear
i just feel its more romantic when these characters do not jump on each other on the first opportunity they get,love
i feel reluctant to go overseas one interesting fact is how the whole education system is so screwed up that to us ip seems so wow cus only a few schs get to go ip but to the schs,fear
i do is send that heavy energy down into her as an offering and i keep the piece on the ground until i feel that that energy has drained out of it into the earth,sadness
i feeling so aggravated about all of this,anger
i also feel paranoid and anxious,fear
i love this connection with the outdoors hearing the birds just returned from afar and my face getting nipped by the gentle chill of a spring breeze and feeling like im doing something productive,joy
i couldnt hellip even when it made my heart ache to simply look at you hellip because i loved you so much and i knew you would never return my feelings hellip and i couldnt bring myself to hate you for the idiotic stunt you pulled in the other room either though i do ask that you dont repeat it,sadness
i don t know why this makes me feel so distraught,fear
i like the domestic scene salty sweet combos recipe reviews the smell of rosemary babies the feeling of having exercised hand clapping rhymes books lost teacups and laundry that has been washed dried folded and put away,sadness
i feel like the nytimes publishes an article like this every year or so and each time we get pissed and feisty quick to lash out with a slew of offended and defensive responses,anger
i feel worthless confused edgy and mentally drained,sadness
i feel bad that i dont have a groupie shot with dan,sadness
i feel empty and i wait for new signs,sadness
i just feel very cheated and quite frightened that i was invaded like this,fear
i feel like im smart now,joy
i have been a pro at hiding my true feelings but the cracks are coming through so i am going to repair them and throw myself into being the supporting happy rock again,joy
i feel successful in balancing my paid work and family life or i am satisfied with the balance i have achieved between my work and life on a scale of to,joy
i started having that creepy feeling again like she still hated me,anger
i guess this is a memoir so it feels like that should be fine too except i dont know something about such a deep amount of self absorption made me feel uncomfortable,joy
i am so sorry for you to feel heartbroken when this should be a happy time in your life,sadness
i went to bed feeling pretty proud of myself even with the flubs i had a positive day,joy
i want to wake up every morning and feel excited about what s to come,joy
i did that last night and woke up feeling groggy until about lunch time,sadness
i feel such gratitude for the generous gifts we received on our wedding day over years ago,love
i feel eager to push forward but so far havent applied myself completely to it,joy
i start to lose that sense of independence in that i feel a lot more hesitant to do things,fear
i feel the cool night air against my face,joy
i feel my sweet boy traveling this difficult road alongside me,love
i knew my dress instantly last time because it made me feel special thats the reaction i wanted this time too,joy
i see newborn pictures though especially the kind taken in the hospital i mostly feel acutely sympathetic to the exhausted people holding these tiny swaddled and red faced confusing beasts,love
i got a lot of ideas and feel like the weekend had a very positive effect on me,joy
im old enough to have experienced lots of the stuff that jake encounters in albeit as a child and it jives with and jogs my recollections and induces a feeling of longing for older simpler times,love
i had the same physical problems years ago that i have today i would have thought i would never make it to while i now feel less bothered by those same problems since i dont have a choice and dont care to let them bother me,anger
i didn t feel useless anymore,sadness
i guess i feel a little vulnerable because i have to undergo all these physical changes in front of the whole world and it seems a little daunting,fear
i feel so disturbed and unsettled that i m not sure what to do at this point,sadness
i feel benevolent towards you today,joy
i feel awards are for people who are enormously talented,joy
i know i cannot rest of my laurels and its a a way of life now otherwise my bg will rocket again but my god it feels super good to know that i have made a massive difference in only months,joy
i feel rude taking pictures of them,anger
i am feeling pretty guilty about posting pictures of some stray cat i cuddled on the street and not even posting pictures of my own two cats,sadness
i feel cheated and at another i feel ashamed to have missed such a glaring defect,sadness
i it seemed like forever i want to put my phone life in knowing loving feeling seeing believing trusting and caring for her,joy
i spent most of the first day feeling pissed off thanks to the tourism and hospitality workers who trump thailands comparatively feeble efforts to fleece gullible white people,anger
i just cant stand that thick dragging feeling of oil paints so im glad i had the underlying texture on the wood to give the painting some extra interest,joy
i start to feel more appreciative of what god has done for me,joy
im feeling quite sad and sorry for myself but ill snap out of it soon,sadness
i feel sure that were i placed into a spanish speaking culture where no one spoke english it wouldn t take me long to be able to converse on a rudimentary level but that s unlikely to happen,joy
i am feeling frustrated or angry with my husband in general,anger
i feel restless and move walking a long way to find another right place,fear
i just started taking mine yesterday and i feel kinda funny,surprise
i must say that i feel a little depressed because everything i know could be completely meaningless,sadness
im feeling incredibly grumpy today a combination of hay fever rain and the stress of our hopefully imminent move,anger
i am feeling stressed like that is to the water,anger
i guess i feel betrayed because i admired him so much and for someone to do this to his wife and kids just goes beyond the pale,joy
i am still feeling gloomy and down,sadness
i was feeling very bah humbugish coming out of this year s thanksgiving weekend and was not thinking pleasant christmas thoughts about the gift giving guilt trip conspiracy run by the marketing racket the decorating and the whole thing in general,joy
i feel amazed when i saw the final result even thos without fishes inside,surprise
i had started about two days ago with some sound sensitivity that i hadnt been having for a little while and then i started with feeling almost like motion if you will from movements and then started with smell sensitivity but luckily it hasnt bothered me since last night,anger
i want so much to feel successful and not frantic that my prep time can be what takes up my own time for painting my own projects,joy
i often feel like a traitor to my sex but i am assured by the fact that i feel i am helping men become better candidates for interaction,joy
i turn up feeling more than a little apprehensive,fear
i didn t take the time to count the money partly because the cashier was already ringing up the next customer and i was feeling a bit rushed and in the way with the next person in line crawling up my back,anger
i feel my morals are being seriously assaulted and comprimised,fear
i feel sympathetic to the dalai lama,love
i feel no need to offer it though i do feel a bit suspicious in the area of is she doing this just to try and lump all the people who have bothered to argue cogently with her in with the woman hating misogynists,fear
i won t feel like the jolly green giant while clothes shopping,joy
i feel a little damaged,sadness
i feel stressed or my family is being negative work is my getaway and every stressor goes away because of the kids,sadness
i party darling don t close ss ur eyes just look at me wll feel hotest body excotick beaty between in my to leg s will be yummyy and u wll be deisire just take a horny enjoin movie record,love
i was feeling fine,joy
i feel amused and free,joy
i needed to relax b i didnt really feel like being productive and c the weather was not,joy
i feel fucked tape re recorded,anger
i feel like they hated me but i m too scared to listen to the tape,anger
i remember feeling so thankful to be able to put my feet up and enjoy taking care of newborns right before id be able to take care of my own,joy
i was just telling you how i feel about you and all you reply back was just since when you started caring for me so much,love
i wasn t feeling especially sympathetic,love
