Post_Text,Emotions
i want and don t want but i m starting to feel resentful about him missing all the signals i m sending him,anger
im feeling the christmas spirit so it seems like the perfect time to mention an idea ive had swimming around in my head,joy
i am feeling more and more eager to get on with my move,joy
i feel more and more convinced especially after a very rough last year that finding someone you love and who loves you wholeheartedly in return can change the course of your life and give the spice and emotional support to live it,joy
i feel as if i am the beloved preparing herself for the wedding,joy
ive this bad feeling that im being hated,sadness
i feel shamed in a way but in another way i just dont care anymmore,sadness
i feel embarrassed writing about it,sadness
i feel like im so spiteful so negative about everything and everyone now,anger
i feel oh so irritable and then it all spins round again,anger
im quite bored but feel intelligent for no real apparent reason,joy
i feel as if he was getting beaten to areas of the ice a defenseman shouldn t,sadness
i just finished watching the desendants and young adult and im left feeling strangely blank,sadness
i really want to be a better person and i finally feel confident enough in myself to take the next step and create the building blocks of a new successful life,joy
i feel i ve had more unhappy years than happy ones,sadness
i now know how bad it feels like to have someone disappointed in me,sadness
when my grandmother died after a long illness,sadness
i feel a little vain i guess but last time i did this i seriously composed a a href http inthewarmholdofyourlovingmind,sadness
i have also been getting back into my gym routine so im feeling positive about this now,joy
i want to do those things while im still young and feel a little fearless,joy
i feel terrific but won t hammer it home,joy
i am feeling uncertain about anything that we can have an open dialogue about it,fear
i anticipated feeling ecstatic jubilant over the moon wired giddy,joy
i accept the medication until i dont feel too troubled by those i will never have the full benefices from them,sadness
i do have some pictures in my head of stuff i d like to sew when i get a chance if i m feeling brave i will blog about these projects if for no other reason to make others feel better about themselves,joy
i have often observed that at times when it seems i should feel something im surprised by how disconnected i feel to the people and world around me,surprise
i feel quite jaded and unenthusiastic about life on most days,sadness
i feel like being casual,joy
i feel like i ve been having some issues with focus and exposure lately and i m not sure if it is my camera or me,joy
i feel excluded and worthless my connection to everyone summarily cut off,sadness
i cant find it and yet i feel that i am longing for something,love
i feel less keen about the army every day,joy
i feel like a graph doesnt show the data accurately enough to be useful,joy
ive been feeling kind of bitchy lately,anger
i have personally experienced this gut wrenching feeling and kicked myself later for making those dumb mistakes that result when anxiety gets in the way,sadness
i feel for the death of this innocent child i dont trust her or her story,joy
i get this overwhelming feeling that i am truly blessed,joy
i feel more outgoing than ever,joy
i rarely feel inspired and ready to write,joy
im sure of how i feel and what i want in life everything has gotten messy,sadness
i meet up with the team i don t feel welcomed or accepted,joy
i almost feel funny not adding a picture at the bottom of my post like denis and dave,surprise
i will help you in setting the table picking up the dishes after we finish eating and if i feel particulary charming on that day will not pick at my food search for lizards in your house or come out looking green to my gills after having used your restroom,joy
i have gained some weight i feel very insecure in my self image,fear
i have had several new members tell me how comfortable they feel with how accepted they are by the existing members and that is great to hear,joy
i have had several new members tell me how comfortable they feel with how accepted they are by the existing members and that is great to hear,love
i try to share what i bake with a lot of people is because i love people and i want them to feel loved,love
i remember feeling loved and beautiful and special and sweaty to be honest,love
i started feeling bad i began taking zicam and it seemed to help for the first week until the day i was driving to the race,sadness
i could still feel all romantic ish,love
i feel honoured that this small person who i have only known for a short time felt that he could trust me enough yet other adults around him are so hideous,joy
i feel so useless as i am bent on p here on the floor,sadness
i feel that my heart broke for barney,sadness
i don t know why i should feel humiliated to write about it,sadness
i was feeling unhappy and i said no,sadness
i am feeling very blessed today that they share such a close bond,joy
i feel pretty shitty and it s not my fault other people don t appreciate what i do but still i can t help feeling as if i deserve it,sadness
i want to feel pretty or handsome or something,joy
i feel unimportant and small here lately,sadness
i am feeling too grouchy to be properly penitential,anger
i feel so damn fucking disgusted violated and hurt and angry and everything,anger
i cant even describe to you what it feels like when suffering from a life threatening disease how easy it is to just give in and answer those knocks of death at your lifes door,sadness
i feel very privileged to watch such beautiful dancers move and call it work,joy
i am feeling a little happy with him,joy
i love if i feel a cold coming on,anger
i could say i was feeling fear or anxiety or that im terrified of what the future may bring,fear
i just know to begin with i am going to feel shy about it,fear
i can feel more productive,joy
i yori aoshi and possibly other stuff brought back a lot of old forgotten values and feelings i had towards a relationship if anything the innocent feel to it where nothing is complicated and its just about being with each other,joy
i wanted to press charges against the people up the street and i guess he didnt feel like being bothered,anger
i viewed back the new year card that you presented me i can feel your sincere,joy
i feel aching for honest release,sadness
im feeling very distracted today,anger
i feel that the pagers definitely damaged the deaf community social time,sadness
i sit here at munching on vegetables hummus and ranch i am feeling very distraught,fear
i feel like im heartless cuz a week after my boyfirend of months broke up with me i was thinking about another guy,anger
i feel i have to do its my creative calling my lifes passion,joy
i am feeling awfully lonely today and i dont want to burden any particular person with this because everyone has their own shit,sadness
i have a positive or negative experience depends largely on how much i feel control was either respected or taken from me,joy
i got a sore throat then a runny nose then a full blown congested head cold which fell on the bank holiday tuesday and has left me feeling low and blue and bleurgh since then,sadness
i feel incredibly lucky just to be able to talk to her,joy
im going to have to spend the next five hours listening to three days grace to work it out of my system and you know how i feel about their rebellious apostrophe neglect,anger
ive seen a lot of seizures but never this many at once and of course i always feel totally helpless,fear
i struggle with those pressures when i don t feel like pulling myself together when i want to toss a scarf over my messy hair and grab some milk at the store when i want to snarl at someone rather than do racism for the umpteenth time,sadness
i thought to myself feeling amused,joy
im feeling appreciative of the physical world around me and if there are other riders in sight i often admire their physical stamina and riding style,joy
i feel from no longer being burdened with those i have to tip toe around and be careful about what i am saying or feeling is unbelievable,sadness
i feel cold in,anger
i honestly was not sure if the pain i was feeling was a case of irritable bowels or indeed contractions,anger
i are just relaxing together and i feel ecstatic and blissfully happy because i know he loves me and i love him,joy
i feel like im being punished for something that i didnt do,sadness
i had no particular feelings about him before except that he seemed decently clever taking pictures of the alien instead of the chaos,joy
i did not directly react to the spot fixing controversy she espressed her feelings feeling on twitter by tweeting the lyrics of a popular bollywood film song,joy
i use to never ever kiss anyone but i ve kissed different people in the last week and a half and needless to say im feeling a but slutty,love
i am suppose to be doing but i keep putting them off you know feeling inadequate and all that stuff,sadness
i feel as if i am naturally talented in though i know each one needs improving,joy
i feel that people often offer compliments not because they are sincere true but because they want the person to feel good,joy
i feel rich comments,joy
i feel rude if i bbm non stop,anger
i feel that i can t trust my mentor with secrets because i am afraid that he or she would tell my parent guardian,fear
i call my ex so i don t have to feel guilty about all the other men i m sleeping with whilst he s doing a four year stretch,sadness
i don t know i feel really helpless about it,fear
i am frankly surprised that you consider the minds of the quorum members weak and susceptible to doubt and furthermore im surprised that you feel that their faith in the church could be shaken by the letter i posted on my blog,fear
i started this blog with pure intentions i must confess to starting to feel a little disheartened lately by the knowledge that there doesnt seem to be anybody reading it,sadness
i feel like youve hated me ever since i was born and you wish i was never born,anger
im feeling rather festive here in south florida,joy
i feel the cool edge of the barrel against my head,joy
i know have no problem meeting new people and feeling accepted,love
im also pretty upfront about stating that i feel agitated and to just give me a bit of space to deal,fear
i feel for the kids of troubled homes and i feel for the ones who could change that around,sadness
deception from a person i loved very much,anger
i had finished my first leg the toughest longest and hottest one of my three but i was not feeling so hot,love
im just feeling grumpy and impatient and im ready to get things moving,anger
im in college and feeling really lonely,sadness
i had one sip and already i feel dazed,surprise
i was feeling sentimental,sadness
i go around people and i act normal but it feels strange,surprise
i thought i would miss feeling useful,joy
i need the damn thing to suddenly animate and dance a jig while singing i feel pretty oh so pretty,joy
i feel i should share with you this wonderful business concept that will change your life if like me you have little time to spend in the kitchen grocery shopping or browsing the net for new exciting recipes,joy
i didnt think that it would come that fast or would come at all but i suppose it is because i feel cranky today,anger
i can feel the ice cold water freezing my insides especially coming in through the bottom of my feet and the numbness starts,anger
im with my boyfriend and friends i feel fine and genuinely happy but the minute im alone i feel depressed,joy
i feel most productive when i feel like i m building something even if it s something no one wants or will use or read,joy
i feel that he s being sincere when he says that he does love me but there s this whole other part of me that keeps telling me that he still loves the other girl,joy
i feel eager to go back,joy
i feel skeptical about relationships between others when they seem so upfront about there emotions,fear
i want them to feel as thought it is family friendly and will be enjoyed by all ages,joy
i also feel ashamed at the hurt caused and ashamed at the things ive done that were not in my character and were down to being manic or whatever you want to call it,sadness
i was feeling restless,fear
i will just say i feel emotionally calm and centered i just feel that as my self respect grows my desire for better things naturally progresses,joy
i started noticing then puzzling finally feeling a bit alarmed,fear
i feel like it just gets ignored or perhaps i really have done a damn good job convincing the world that alls well when really i was only dreaming as one omd song goes,sadness
i was living with when i first started coming to the gatherings on sunday mornings i feel quite fearless now,joy
i feel splendid sublime euphoric,joy
i find myself feeling so lost and desperate because of the things that happen every day but being a human of course i have times where i just cannot be comforted,sadness
i so desperately want to be able to help but i feel so helpless,fear
i couldn t help but feel slightly skeptical and apprehensive as i realized the tough task funes was taking on that night,fear
i feel like the th photo doesnt even look like him but its real cute so i had to share,joy
i shake my hand off which feels slightly stunned from making contact,surprise
i always feel guilty and come to one conclusion that stops me emily would be so disappointed in me,sadness
i touch you with my feelings hold you with my thoughts and with a smile i fall in love not caring at all display the heart,love
i feel an ache when my phone chimes and it s not a sweet text from my sweetheart,joy
i feel so incredibly hopeless about losing weight,sadness
i feel so eager to do things the way he wants and likes,joy
i feel jealous angry or bitter ask why,anger
i do think as he was feeling a bit of humiliated they did not have an excellent alternative they wanted all of us to clarify the fact that stop mortgage is working,sadness
i told him well that just makes me feel really unimportant that you cant make the effort to get it straight,sadness
i tell myself i dont open my mouth and say what i really feel because i know im a loon and im smart enough to know im a loon and i never ever know if what im doing the choices i make are really what i want or need or even the right thing or if its the disease,joy
i feel inadequate because it prompts comparison,sadness
i was feeling all depressed about fabric prices and about how much money this hobby costs,sadness
i feel like the moment i see him is the most precious time,joy
i like the kickoffs to borrow an expression from an englishman i know because i don t feel rushed in the morning,anger
i feel it is my sincere duty to rid you of that house that god scared into being built,joy
i still feel like im getting away with something naughty,love
i don t speak more than a few words of the local language and i have to rely on him to translate the conversations for me i feel submissive,sadness
i sometimes feel like i am being paranoid but i know that these thoughts are silly,fear
i hate hate hate watching people work and me sitting and most of all i hate people having to take care of me so i thought i was healing at a fine rate i was feeling fairly strong and energetic just seemed to get tired quickly and i could manage the surgery healing pain,joy
i am feeling amazing,surprise
i will just say that i feel jealous and angry,anger
when i was doing research a few months ago,anger
i begged her to come in the house with me when we got back and she did but left right away feeling distinctly unwelcome,sadness
i will share my home my life and what i feel is gorgeous fun and noteworthy all the while tracking my existence day to day,joy
i feel that my generosity is abused when you steal after visiting my home,sadness
i find it may be a way for me to release my feelings so that i am not troubled when i face the one who has punished my family,sadness
i feel we are being very blessed,love
i don t always feel like i have amazing style and most days i choose comfort over anything else but there is one thing that i feel makes all the difference in how i feel about myself and that is makeup,surprise
i sensed such a feeling when i understood i was admitted to the university i was at home,joy
i feel like this semester has been good for me,joy
i feel bad saying that and like its just an excuse or something,sadness
i was making up a batch of waffles for breakfast the other morning it occurred to me that i might be feeling homesick,sadness
i hate wearing watch but at the same time i will feel distressed if i dont know what time is it,fear
i dont see how we can move beyond it but then rarely do i feel this uncertain about things,fear
i already feel very glamorous have a great day everybody,joy
i feel paranoid about this you havent talked to me in two days and im scared,fear
i popped a fever and even my co workers we urging me to go home before i even had a chance to open my mouth and voice the obligatory i m not feeling so hot,love
i feel grumpy i am short with my wife or children,anger
im feeling good though,joy
im assuming the inquisition er did not mean subspace but more of a state of feeling very submissive,sadness
i am feeling pretty pleased with the amount of work trackchanges has allowed me to document,joy
i am less in shock and currently feeling insulted about being hung out to dry this past weekend burning his things seems a pretty fair rewards for my unappreciated grace under pressure,anger
i not talking about relationships here just that initial moment of attraction when you first meet someone how does it feel at that point to be abit disadvantaged,sadness
i didnt feel all too devastated until i saw people running from the smoke and all,sadness
i feel shy now,fear
im feeling disheartened and have not been looking for matthew guion pictures,sadness
i feel extremely passionate about this topic because that person used to be me,love
i for one am feeling a bit anxious at how long we are staying but i know we need to do this,fear
i was feeling and was surprised when i told him i felt fine no fatigue,surprise
i feel pretty a href http unspokenwords keptinside,joy
i do feel very excited about travelling because it s not often that i get to travel and it s definitely not often that i get to do it for free,joy
i feel stronger clearer but a little annoyed not quite sure why,anger
i refuse to stay silent when confronted with pricks who instead of no response or sorry not interested actually go out of their way to make someone feel shitty,sadness
i am older and my life is very different i can feel how amazed i was that morning,surprise
i still feel horny from that little a href http blogs,love
i feel as hungers savage tooth and when no dinner is in sight the dinner bells a sound of ruth,anger
i do hope youre all feeling fab,joy
i was feeling frightened to the core what if my friends laughed at me what if sir was too harsh what if,fear
i end up feeling lonely,sadness
i would end up feeling rejected and feeling like they just played a cruel joke on me by getting my hopes up just to purposely crush them,sadness
i dunno it feels like you should be since she is the most god damn beloved character in the game right next to rinoa,love
ive begun my fall semester and i feel thrilled,joy
i thank you from the bottom of my heart because you ve gifted me with the confidence i needed to feel like the things i want to share will be welcomed and maybe understood and maybe even helpful,joy
i think real men are those that open doors for you who behave chivalrously like walking on the sidewalk closest to the street to keep you safe who hold your hand and make you feel like you are treasured,love
i feel irritable when he starts talking about it because it can go on for ev er,anger
ive been having more frequent hot flashes throughout the day sometimes and im starting to feel just a tender touch of achy pain in one spot in my back which i hope isnt another new bone tumor metastasis,love
i feel repressed enough as it is and these sorts of repressive measures and guidelines only succeed in making me want to have more sex and partaking of the revelry that comes with being a dirty slut,sadness
i think youre being a dick bitch id just walk away instead of laying out everything i feel when im pissed i shut down and look out the window in steely silence,anger
i am feeling pretty relaxed though,joy
i feel smug,joy
i was feeling a bit skeptical about my frog prince,fear
i honestly do not feel discouraged today as i usually do,sadness
i feel i should say what i want since you are in fact reading my diary i feel that many of my beloved readers are becoming offended with some of the things i say and post here,joy
i was feeling pretty strange like dinosaur soldier after i read them because in a weird sort of adult or perhaps college aged way my brain was analyzing the books,fear
i feel strongly that those who finger point and wish to control other peoples lives are not feeling very peaceful and content within their own lives,joy
i get projects where i am stuck and i feel so foolish when i have so many questions to ask,sadness
im still a little mixed on how i feel about him back especially because i liked the a href,love
im feeling rejected,sadness
i am feeling more determined than ever now and i will reach my goal weight,joy
i cannot imagine what african americans feel inside their hearts and guts when they see such a hateful image,anger
i definitely feel like those are tender mercies from heavenly father,love
ill just cut amp paste it next time i feel the urge to type something as whiney as that,sadness
i always feel regretful a few weeks after,sadness
i feel strongly about amused,joy
im in so much pain and i feel like a useless lump face,sadness
i feel doubtful and afraid,fear
i feel invigorated when i look at this image just as i did when i looked at the other two photos,joy
i do feel productive anyway,joy
i am a big believer in the phrase that some people are all style no substance and i feel that if you have nothing worthwhile to say just dont say it,joy
i feel perfect with you on facebook href http www,joy
i just feel discouraged because the industry is enormous what makes me special in a sea of pretty girls,sadness
i was creating a relationship to counter a self accepted and allowed self definition of being inferior to them which means i was feeling lousy thinking i was less than because i was not being in the limelight of praise of gain,sadness
i must tell you that i have been doing much more yoga lately and i feel all lovely and loose in my joints and muscles,love
im writing for those who have been told that they are weak or that their strengths are weaknesses and they were made to feel ashamed,sadness
i feel so terrified to tell her,fear
i never feel like it s actually dangerous but the sirens drown out the pogues and the reggae both about three times an hour,anger
i eat or sleep i cant get myself to feel the life loving energy i felt so easily before,love
i just love the way you feel and i wholeheartedly vote for adopting the gorgeous and healthy and scented amber queen lovely lady,joy
i ever feel ugly or ashamed of my body,sadness
i feel unwelcome in this town as if my time here has been spent my quota of memories well past brimming and my eviction notice is long overdue,sadness
i felt and still feel really horribly that i scared the poor guy so much that he dropped his tail but im eternally grateful to him for teaching me this fact,fear
im no longer feeling bitchy,anger
im bored and feeling ignored,sadness
i think my taiko experience so far has been at the root of my feeling dissatisfied and somewhat unhappy lately but theres just something else that i havent been able to explain,anger
i am feeling a little stressed about my book club coming up and dont know how im going to fit people into that place,anger
i just feel like if i can just make it through this week it will be ok,joy
i feel like a super hero of sorts,joy
i can feel her pissed off attitude towards me from far away,anger
i feel like if he was innocent he wouldn t feel like he has anything to prove,joy
i don t feel all that petty about crying over skin,anger
i feel like its one of the most valuable tools in my art box,joy
i feel generous and remain composed,joy
i feel sad that someone i once knew is leaving as someone i once knew,sadness
i feel in perfect height or just height threads picture images,joy
i feel i have rushed moments where i begin to take this life here for granted i just look at them they look at me and my graced life becomes the stage again warts crushed worms under foot and all the other conflicts that come with it,anger
i sincerely feel will benefit any relationship whether it is romantic family work or socially oriented,love
i cant sleep i switch on music if i need to wake up i switch on music if i feel morose music it is that comes to my rescue whenever i feel ecstatic the tunes are by my side if i want to meet my wild side hail music,sadness
i just didn t feel thrilled by the whole experience,joy
i feel awful still but really,sadness
i feel that popular culture especially in the uk and the usa is mired in an unsavoury mix squalor and stupidity,joy
i bet yahoo feel pretty shitty right now,sadness
i were not told of this news i would not feel regretful rather be unable to quiet my heart now,sadness
i was feeling sentimental and so it made sense to commemorate the milestone with a book,sadness
