Post_Text,Emotions
i am hoping i am still feeling playful in a few days,joy
i feel the eyes on me the hateful eyes on the other side of the glass that belong to the family members of my beautiful victims,anger
i do struggle i dont get anxious instead i feel that much more determined to succeed,joy
i first got my eye infection i have to back up and if possible make you feel less sympathetic for me than you probably already do,love
i read i feel like ive just enjoyed a rich journey through the history of settling the american west as well as through the values faith fortitude hard work and joy so readily cherished then and hopefully now,joy
i took a sip tonight and am feeling pleasantly mellow,joy
i feel kinda popular,joy
i mean i know how it feels that a person is valued by the family if s he gives money or food to the table,joy
i guess sometimes you arent aware of your true feelings until a playful kiss exposes them,joy
i have spoken to are so pleased with the facilities often feeling really valued for the first time with their needs being properly recognised and properly met,joy
ive been feeling pretty terrible for weeks so it would be hard to get significantly worse from where i was,sadness
i have a feeling that there will be plenty of football watching and that we will be indulging in many delicious eats this weekend,joy
i returned home defeated and feeling totally unsure of who i was,fear
i am very i feel very privileged having said all that i am very privileged,joy
i have a feeling there are a few more perfect moments coming,joy
i really shut myself off a lot at the end of my pregnancy when i was feeling even more irritable and anxious so maybe now i need to bounce back from that and get back to normal again,anger
i along happy peaceful feeling fantastic,joy
i feel virtuous because all day i have cleaned a house that needed the mopping and tidying,joy
i just ran by feel and i m glad i didn t look because i probably would have freaked out which happened a little later on in the race,joy
i dont think i misinterpreted at all helped me feel more assured about the sort of work i had been doing and continued to do,joy
i can feel the strokes getting harder and faster as i try in vain to find that release,sadness
im told by horsey people that they are a rare find so i feel quite lucky,joy
i feel glad and enthusiastic about the point of sand snorkeling,joy
i feel this urge to update because i resigned from my hour job making coffee for people a day by myself,sadness
i feel like the helpless duckie target for the commies and feds while at other times i want to run and hide,fear
i know this isnt real but it feels strange to me at times,surprise
i learned the silent crushing pain of not being wanted and feeling i was unloved,sadness
i will hopefully be able to feel less inhibited in my writing and not so much like i write too often,sadness
i can t believe all the newborns that i ve photographed with heads full of dark hair but i am feeling just a little envious because my babies are bald and blonde as they come,anger
i feel it is not a talented precisely i need a tiger the tiger is a dance from the tiger,joy
i feel as though i am living on an island as i put the delicious moisturiser on a sample which is lasting a very very long time used twice a day and the rest of the products are so gentle yet cleansing and moisturising,joy
i feel completely blessed to have such wonderful family and friends,joy
i would feel too embarrassed,sadness
i brush it to the side or tuck it behind my ear only to feel a few rebellious strands escape and tickle my cheeks and my lips i realize im not the one in control,anger
im feeling the need for a cute little monogrammed one in green for mommy,joy
i ain t shot a bitch since this morning so i m feelin a little gun horny,love
i am hoping the weatherman is right with his forecast of stay at home dont venture out rain for tomorrow i am feeling all kind of creative,joy
i feel im being generous with that statement,joy
i feel im being generous with that statement,love
i am feeling is also a blossoming eager anxiety,joy
i can also song write without feeling all bashful about it and play music and my guitars without anyone telling me to turn it down,fear
i feel dirty if i dont,sadness
im still paying attention but i feel distracted,anger
i feel hesitant to comment because i don t want to add to a pileon but it seems clear to me that those involved haven t learned from their past experiences nor are they interested in applying that learning to future projects,fear
i hate ever putting anyone in awkward situations and ever causing anyone to feel unwelcome such thoughts strain my heart so,sadness
i know that there will be days that i am going to feel discouraged,sadness
i feel satisfied only with details and small parts,joy
i feel disturbed when i see people break into pieces right in front of me because of love,sadness
i feel hesitant about talking about this,fear
i quickly learned just by moving from sauna to ice cold bath to steam room to shower until you feel like a tortured goldilocks who wants nothing more than to find the middle ground between too hot and too cold,fear
i was not feeling so nervous because she seemed so calm and collected,fear
ive gotten so used to hearing from david all the time i havent heard a lot from him tonight he stayed over last night and as a result im feeling a little paranoid,fear
i feel is loving,love
i am feeling rebellious which is often i suppose,anger
i feel i will never escape something drawing attention to my forehead when distressed because i imagine old age will turn the scrunching into permanent wrinkles,fear
im feeling defeated,sadness
i was most stressed about have finally come to an end and i feel relieved,joy
i feel it rarely advances any worthwhile cause and i always stick to the rule of not posting anything online that i wouldnt be prepared to say to somebodys face,joy
i try to breathe in when i feel frustrated and breathe out the calm that i desire,anger
i should have known she likes kamiki kun he laughs nozomi feels an unpleasant knot in her stomach you must think i m a fool don t you nonchan,sadness
i still didnt feel like the problems had really been resolved,joy
i feel like a paranoid stalker or something,fear
i bought a virtually fat free thousand islands and feeling very impressed with myself hold large quantities of this substance on the leaves of lettuce and cucumber with my friend but it will be total sugar becomes if you do not burn fat,surprise
im feeling it would be obnoxious,anger
i was in i could feel him and i hated the drawn tight feeling i had,anger
i may pour out the half empty cup here i will still be making significantly less than i was making at the age of fresh out of college is an entire dollar and some change more an hour which feels like sweet desperate progress,joy
i just have to figure out how to really put it into practice without anybody feeling like their contributions and ideas are not valued on the team,joy
i feel if journalists then blamed me,sadness
i don t feel dissatisfied just distracted from my life,anger
i remember that we would always pat my head ahaha lt i feel like a puppy and this other guy that liked me kindaish also patted me on the head too so i guess that s a good sign of harry liking me if he patted my head maybe he thinks my hair is soft sighhh,love
i doubt theres any greater reluctance by federal authorities to employ tear gas and plain force if they feel threatened,fear
i cafeteria i sit sitting myself feels hurt scared,sadness
i feel nervous when i think about going to australia though i feel exited at the same time,fear
i am your friend then why do i sometime feel so insulted around you,anger
im stressed angry upset to the point where im feeling numb but one more bad thing is sure to set me over the edge,sadness
i say i only sort of knew him and i don t want to make it like i m personally devastated by it i m certain those who were close with him are feeling devastated and i don t want to appropriate that or disrespect that grief,sadness
i feel so worthless during those times i was struggling finding work,sadness
i should have been at the pub instead of which i stayed at home feeling morose and depressed,sadness
i feel so fucked up from what happened on thursday,anger
i dont know how else to word it i miss feeling respected by a guy and being able to hold a guys hand around the mall knowing hes all mine,joy
i woke up today with totally no text so i was feeling pretty gloomy at first then my precious idiotic don called and cheered me up,sadness
i thought i was ready for commitment for a relationship with someone but when it happens i just feel numb,sadness
im known to feel affectionate toward those who adore leonard cohen is what makes me like him quite a lot,love
i cant help but feel someones going to end up pissed at me,anger
i feeling dangerous at wimbledon width,anger
i say to that because she definitely has a right to feel furious but i dont think ive threatened anyones life ever in anger,anger
i have a pit in my stomach feeling disappointed,sadness
i feel this helps create rich texture and a touch of mystery to an outfit,joy
i was feeling quite clever at that point and i had not had even a drop of wine,joy
i can not help this feeling i am more considerate care of the owner,joy
i do know that the stresses from this past week sensory overload oh and i have not been sleeping well are all contributing to my stoic type of feel however i am rather jolly and do not feel like i am in an icky mood at all,joy
i feel fearless janelle mon e elle canada february img width height src http www,joy
i feel like an idiotic twat for some of the things i have written in the past and for some of the things i have advertised having done,sadness
i could feel what was going to happen at the very end but it still startled me,fear
i feel surprised that scientists to actually question about how it is weird for the initial conditions of the universe to be fine tuned to very special values such that our universe is almost flat,surprise
i really cant count the number of times i cried feeling overwhelmed by someones expression of concern or just by the very fact that they were thinking of me,fear
i knew i wanted to somehow include the idea of natural healing and holistic living but the site is also about feeling radiant vibrant and enthusiastic about life at any age,joy
im slow about this but it does feel weird returning to a home without your mum anymore,fear
ive had a lot of good days where i feel fabulous and have lots of energy but lately ive also had some bad days where i feel gigantic and slow and clumsy,joy
i guess avoiding the boundaries conversation with him has me feeling a little unsure about my confidence and strength,fear
i feel humiliated by my ignorance and lack of ability to accommodate the other,sadness
i definitely feel he should get a title supporting and the picture for once,joy
i feel inside cause life is like a game sometimes but then you came around me the walls just disappeared nothing to surround me and keep me from my fears im unprotected see how ive opened up oh youve made me trust cause ive never felt like this before im naked around you does it show,sadness
i shouldnt feel gloomy,sadness
im worth something on those days when i feel less than acceptable as a human being,joy
im feeling so devastated by losing something that others may see as trivial my god takes on that weight as if it was his own,sadness
i now feel more intelligent about my followers myself and how i use a href http twitter,joy
i present two photos of myself side by side and in one photo i remember feeling cute that day,joy
i feel so thankful to be on their team,joy
i was feeling playful so i danced around the place,joy
im feeling doodly playful artistic hungry puzzled trendy stellar and wonderful,joy
i went to work like normal and didnt feel bad in any way shape or form,sadness
i sort of feel a bit unsure now as to what to touch upon next,fear
i always had to eat everything on my plate and ate and ate and ate without feeling satisfied,joy
im feeling fine,joy
i cannot and i feel a strange sadness for a thing that i m now ready for but cannot do,fear
i wound up driving to him getting butterflies like a teenager when we kissed then feeling rotten for a week after expecting him to call,sadness
i feel better i dont for a little bit,joy
i feel passionate about sharing and want to hear as well as spout my lulu isms,joy
i can admit that even though i feel horrible now,sadness
i said on fb i was feeling strangely discontent tonight,sadness
i do feel very contented with this simple homely life,joy
i left feeling annoyed and angry thinking that i was the center of some stupid joke,anger
i didnt feel as amazed as i expected their nail area is quite small and isnt very posh and cushy like i hoped,surprise
i feel slightly offended,anger
i feeling so uncertain concerned afraid of this person circumstance environment change,fear
i can sit here and say its a warm feeling that overcomes you and you feel reassured but that isnt good enough,joy
i feel in my belly perfect two you can be the butterflies i a class imagebox href http s,joy
i like to participate in sketch challenges from time to time when im feeling inspired,joy
i was feeling adventurous and took the stairs,joy
i still feel quite loyal in other views on the conservative side,love
i feel divine and strong,joy
i remember feeling dirty after the swallow bridgewater race and i wasnt even paying too close attention to it,sadness
i get the added bonus of feeling superior and healthy because of everything weve been hearing lately about a href http apps,joy
i almost feel greedy for believing that i want so much,anger
i decided to focus on how i was feeling and what needs were not being met for me in this situation rest calm enjoyment relaxation,joy
i resented being made to feel like a bad person for not possibly contributing to the better good and to the profits of some unspecified equipment maker,sadness
i feel like i m living in a strange world my wife s paternal grandmother often said,surprise
i feel and however tragic their situation that s no reason to increase the wage,sadness
i hate even doing this because i feel like it s rude but i must say i love the blog it came from and this is no insult to the food photography because i enjoy it,anger
ive been at home for almost a week now from the hospital though and i feel the need to divulge info to devoted readers who have felt starved for my stylings,love
i think he was feeling playful and lonely cuz he was the only creature in the living room,joy
i have seen you fall asleep climbing back into bed before you were even horizontal and now i am awake and my neck is cramped and i am feeling hostile and cheated,anger
i feel rushed trying to get everything together late at night,anger
im feeling discontent with everything and its manifesting itself in destructive self sabotaging ways,sadness
i do not like the originals but i want rebekah to have a satisfactory ending and not to be shamed for feeling and loving by klaus and to some extent stefan and damon,love
im not feeling outgoing and am in no mood to put the game face on and smooch,joy
i attended a session in the pub afterwards and i m feeling a bit tender this morning,love
ive been feeling a little burdened lately wasnt sure why that was,sadness
i feel a hint of my beloved art nouveau era in this bracelet,love
i felt better on thursday and today friday felt good enough to come into work though i still feel kind of shitty and foggy,sadness
i could feel the frantic need in him the need to make me his,fear
i have to leave my hair alone now if im feeling impatient,anger
i soon went back to feeling shitty again,sadness
ive been feeling super run down all morning and debated whether or not to leave my usual closed for business type illness post,joy
i know that i shouldn t let people decide my happiness but damn it feels like i either have to risk my happiness to please other people that s how much i hate this school this school is fucking pathetic and doesn t deserve my time and money,sadness
im feeling generous and yesterday was my year tpt aversary and i have slacked in the blogging since last week as ive been sick,joy
i travel i feel like men expect me to be neurotic superficial and easy only sometimes true,fear
i want to feel happy,joy
im feeling more fucked up than ive ever had and its nothing to do with my school work,anger
i feel sad for her,sadness
i discovered out what created my wife feel lovedi was shocked,surprise
i am feeling really bad for that guy,sadness
i merely say i do not feel those activities to be acceptable for godly men for examples to others,joy
i feel it pinging my brain and its not pleasant,joy
i have teamed it with a slouchy studded jacket that i picked up from warehouse in the sale and feel nicely smart,joy
i hate feeling so fucked up all the time because of this,anger
ive said that i feel like i should explain it so yall dont think im perverse,sadness
i was supremely happy i hear the first few notes or bars of the song and i feel the emotions and smell the fragrance of that happy time,joy
i thought i should be excited that im starting work but im feeling reluctant as ever,fear
i think another reason i love concerts is it is the only setting where i feel completely comfortable letting loose,joy
i was around and feeling fearless and excited,joy
i do and love so much i realized that ive simply been cooking and posting recipes because i feel like i have to for content not because i have a story,joy
insulted by disgusting people,anger
i feel so respected and seen,joy
i feel the energetics of the cinnamon tree is supportive for you as you on this journey of self awareness,love
i still feel so amazed knowing i stood right in front of jason,surprise
i believe in luck and when luck is not on my side i feel beaten and sometimes upset,sadness
i feel honored to be with many wonderful artists and to display my work for the public to see,joy
i am too fragile to feel too vulnerable of pain and too easy for tears,fear
i would feel fearful of being killed by other mistresses,fear
i feel so weird and scattered with all wonders about a million different things,fear
went to a movie with a date,joy
i also feel strongly about supporting the local economy so for the past years i am proud to have driven gm cars in a gm community,joy
i start to feel agitated inside,anger
i spent two hours working on my crochet gift for you but i still feel restless and slightly sad,fear
i did the yelling the feeling of being extremely mad,anger
i guess you cant see how wed feel a bit unwelcome,sadness
i feel sure the donation would have been rejected,joy
i was the compere at a party and all my efforts to get the show rolling were thwarted by the immobile,anger
i feel as the author is very passionate about his poem because when he wrote his poem he wrote from his feeling and history,joy
ive been feeling much more confident,joy
i cant hide my feeling when i feel so glad,joy
i feel privileged and honored to attend ptk international convention where i got the opportunity to represent my college along with my other five members,joy
i feel pathetic and am asking myself how i could even let things get to that point but i did,sadness
i feel a recipe is only a theme which an intelligent cook can play each time with a variation,joy
ive been really into the more laid back bohemian feeling style and thought these items would be perfect for a beachy california trip,joy
i said in some recent interviews we will have two guests on the next alcest album and today i feel glad to reveal the first one,joy
i also has the meaning of trusting oneself trusting that we have what it takes to know ourselves thoroughly and completely without feeling hopeless without turning against ourselves because of what we see,sadness
i can feel myself getting agitated at all the constant noise chatter,fear
im feeling pissed off about my aac or feeling kind of miserable and frustrated with life this whole week,anger
ive turned it on a bit but its feeling very casual,joy
i feel rejected by someone i love and this has caused me great heartache and pain,sadness
im feeling sociable again i have a date on monday with someone that wrote to me on there,joy
i feel that i was innocent i did not want to hurt anyone,joy
i sometimes feel inadequate as a mother feeling like im failing him and still second guessing my parenting skills,sadness
i cannot help but feel that my life is a series of not so unpleasant accidents stumbling about trying to do the right thing,sadness
i do feel resentful towards other bloggers writing for and against i don t even qualify to feel offence since delhi girls are obviously punjabi,anger
i started to feel kind of skeptical about this myself,fear
i feel absolutely lovely now with a cup of hot green tea next to the keyboard,love
i think i brag and it feels strange because i still see myself as a little fattie pre teen unworthy of any male attention,surprise
i feel god can be humorous and creative and just so awesome,joy
i feel like ive been to submissive and let too many people just walk over me,sadness
i feel so bitchy and mean and terrible,anger
i find myself feeling agitated because of how what the kids are playing i ask myself did i play this way when i was little,fear
i want to find my essence and my substance and not feel so scared and empty and dispersed fragmented etc,fear
i cant believe the moment where i feel the most useful is when im washing the dishes,joy
i still feel that i expect pieces of the world from him but im afraid to come close and place those expectations upon him again in fear that hell disappoint me,fear
i got the feeling brig is sincere and has a very strong desire to help others become successful both financially and also through building strengthening relationships through christianity,joy
i have for myself even when i m feeling crappy,sadness
im feeling bitchy as hell tonight,anger
i feel i can rely on my instincts more than my intellect but im starting to doubt whether my intuition is as keen as it should be,joy
i do feel confused,fear
i feel humiliated the annoying little college student who takes on causes and pesters everyone about them,sadness
i want to enter in defiance but coming from a different culture i feel offended that i am not allowed,anger
i thought it might and it makes my hair feel lovely and silky,love
im feeling quite cold actually,anger
i make them feel valued and included even when we don t see each other often that it s one of my superpowers,joy
i feel more confident and have to think less about what i say on the days i avoid english and read french grammar in the morning,joy
i now feel like i look really ugly some people think i look retarted,sadness
i grappled with was guilt that relatives and friends who usually communicate with me there would feel like i was ignoring them and i felt selfish still posting my burlesque and blog updates there without liking their photos and links,anger
i feel very rich very blessed very joyful,joy
i know you feel supporting an inept city manager who has cost the tax payers millions already with his bungling is important,joy
i feel like fake eyeglasses will make me look older and hell a little more authoritative too,sadness
i was feeling shitty inside but never show it,sadness
i am so thankful that though things are a bit overwhelming he has sent people into our lives to help me not feel so neurotic,fear
i woke up on the sofa feeling extremely agitated around pm,fear
i am feeling spiteful,anger
i can stay awake whole night feeling all energetic and stuff,joy
i was sitting in church this morning and looking around at the various people scattering the pews and wondering how many of them were feeling beaten down right at this moment,sadness
i am feeling completely overwhelmed i have two strategies that help me to feel grounded pour my heart out in my journal in the form of a letter to god and then end with a list of five things i am most grateful for,fear
i am feeling a bit crappy it is not as bad as it was two weeks ago,sadness
i can feel it in my aching bones,sadness
i know this is supposed to be a cheerfull season the christmas season but this is what i am feeling after loosing our beloved cat tigger earlier this year,joy
i feel pretty posted on a href http playhousecomm,joy
im not sure i can go back to aussie festivals that make me appalled at the youth of today and make me feel glad to be old er and way more sensible,joy
i started to feel cranky and tired up until i resupplied with these vitamins,anger
id probably go with none on and hope that my date admires a confident girl who feels fine without makeup,joy
i run into feel useless i understand that but not because of my retirement it is because my daily struggle overwhelms me often,sadness
i love you all d pagetitle superman mereka penyeri my life without them i feel like blank sheet of paper,sadness
i always feel so unimportant so much that i always wonder if people remember my birthday,sadness
i do feel irritated at times because he tried to hold me and stuff ill push away or not throw temper and shout at him,anger
i are feeling horny and decide to give a double header long wet sloppy blowjob,love
i see this ad i cringe and feel disturbed,sadness
i am sitting here feeling a bit grumpy moanday blues anyone else feeling this way too,anger
i will soak in the feel of my beloved next to me,love
i dwell on this matter the more i feel infuriated that i m so lowly thought of,anger
