Post_Text,Emotions
i feel bitter and just honkerblonked off in general,anger
i have certainly been in places where i did not feel welcomed and i made a point to go on to a place where i did find that feeling of welcoming,joy
i am feeling quite disheartened,sadness
i can see changes on my legs they have slimmed down a bit but i feel a little disheartened that its not that visible,sadness
i start feeling overwhelmed and i just want to run away and hide in the back of my closet,fear
i have stopped feeling surprised,surprise
i remember feeling as if i didn t belong and that i wasn t smart enough cool enough or even young enough,joy
i dont know how to explain to you all the emotions that i felt at that moment but i can assure you of one thing i didnt have to convince myself to feel passionate about dominican republic,love
i feel peaceful centered and an endless supply of energy each day to accomplish what is most important,joy
i was just reporting to a dear soul that the energies feel strange today and wondered if somethings up,fear
i feel like the supportive wife who does whatever he says and sits at home waiting for him to call with a plan of action,love
i feel inspired to make some of the christmas presents im giving away,joy
i feel like the supporting literature cited in this section is not only scarce but also badly presented,love
i said without emotion while feeling a freaked out fearful anxiety welling up in my chest,fear
i feel rude bring my own fridge i do eat food but i guess my option,anger
i was able to be myself and not feel pressured to talk in a group so it was in a way better than all the years in secondary school,fear
i know that when i am feeling distraught or moody i can depend on you two to put a smile back on my face,fear
i feel hopeless and out of control,sadness
i have some feelings i would like to share with you the valued reader,joy
i realized now that i lived my whole life loving some ppl who now i hate the most cause they alll have changed they all became veryy tough ppl after i got used to feel their tender touch in my life,love
i dragged my lazy ass albeit a cute one out of bed this morning i suddenly feel morally superior to everyone else,joy
i have the same feelings toward the word passionate,love
i feel i am really teaching and students get some lovely finished pieces,love
when i knew about my first job,joy
i seriously feel like a prisoner and i feel awfully gloomy when im in school thats why i always want to get out of the gates as early as possible,sadness
i was wondering why i was feeling so ecstatic,joy
ive been feeling really energetic at night and honestly i needed this,joy
i have realized that by ignoring it i am no better and it is heartbreaking to feel so helpless against it,sadness
i feel a little bit sorry for ahem to face hard times there,sadness
i havent gone a week without exaggerated eyelids since year at school i feel pretty fucking shitty,sadness
i feel very hostile at the thought of taking out my credit card,anger
i often feel so distressed and freaked out whenever my child gets sick,fear
i feel like an awful lot has happened in the past week or so,sadness
im sure shes done some writing tonight and is past that amount now but for the moment i can go to bed feeling triumphant and also happy in the knowledge that i havent given in to writing absolute and utter crap just yet and that my story is progressing nicely,joy
i was very good in the morning as i had been to the gym and done a zumba class followed by half an hour swim which of course i cycled to and from so i was feeling very virtuous,joy
i hate the way mom and dad are to her i hate the neglect of her feelings and her needs as an intelligent child that are rampant in their parenting style,joy
i have the feeling she was amused and delighted,joy
i do sometimes feel like im in this strange in between world,fear
i need to reflect on why i feel irritated,anger
i was feeling so regretful i didnt get it the other time,sadness
im still feeling annoyed though,anger
i am however caught by the feeling that i missed out on a lot of interesting conversational banter by reading dead writers write about deader writers,sadness
i do not like chain letters or anything that says you must we all have too many things we feel we must do so i give it to you freely with no obligation that you must do anything except the sincere wish for you to be happy,joy
i feel so empty and cold inside,sadness
i feel like i am living without my apendages and all vital organs,joy
i got a feeling like something tragic is going to happen and im praying to god im not like kristie and that im completely wrong on this one and that everything is fine,sadness
i feel a bit shamed but here it is dr,sadness
i basically wrote this for my future self i m feeling generous and think like i should just give the guy a break and list all the queries,love
i am feeling particularly joyful today and though todays blog entry doesnt necessarily align with my particular emotional state it is a subject that has rightfully found a place of conversation in the public eye,joy
i didnt like that she was intent on getting in between them when they were first starting to have feelings for each other but i liked how she backed off when she realized just how strongly leo felt for clara,love
i could clearly feel my adomen muscles contract everytime i cough like some adomen exercise haha and im aching from it now sigh,sadness
i feel bad that i don t have anything for you,sadness
im feeling really annoyed,anger
i feel annoyed by that girl,anger
i cant describe how im feeling without giving it away but in a way im feeling a bit heartbroken but definitely touched,sadness
i pray that you feel the presence of god around you and that you realize that the birth of gods son was a precious gift for you and you never have to be alone,joy
i feel so helpless without a camera to shoot pics of all the thrifty things i find and my beautiful flowers etc,sadness
i don t want to tell people how my first was with you and how you made me feel i don t want to think that you re the most gorgeous guy i ve ever seen and i love how other people disagree because i don t want them to see how truly wonderful you are to me,joy
i have days were i prefer to be the submissive it is a simple life i feel on the days i am submissive i do my best to please him he seems to be happy enough after two years of having me,sadness
i suddenly felt how statesmen feel when mobbed by the press or how doomed men feel right before they are lynched or stoned by a mob,sadness
i feel im being ignored,sadness
i do know what it feels like when no one seems to be supporting your vision and just admiring it from the outside when you not only invest your time but your personal money that should be feeding your family and still not seeing anything,love
i feel some people go a little overboard with a cake face or just too much going on and end up looking super unnatural,joy
i was feeling very generous wild and crazy and we went through the drive through at steak and shake,love
i havent let myself truley sink into a depressed state of mind feeling like everyone is against me and trusting no one and just basically wanting to die since freshman year,joy
i found it hard to feel for any of the supporting cast who eventually became late night snacks for the vampires,love
i started feeling hostile and i am checking my hemorrhoids,anger
i have been too worried about money and the state of our industry ok and a little surgery to engage in such trips lately but for some hard to determine reason i am feeling a little more relaxed,joy
i feel privileged to have them as a part of my world,joy
i feel your pain whether you want me to or not and its pity implies that for some unfortunate people justice is not enough,sadness
i feel honored she is a legend i admire her although i dont see the similarities between us,joy
i feel more content with what i have achieved and i know if i don t write today there ll still be a tomorrow,joy
i feel the earth move tribute to carole king karaoke mix bewertung rel nofollow target blank,sadness
i try to find something that does not make me feel foolish,sadness
i really do feel as if i can finally create something lovely in my new room,love
i could feel my body start to shake with nervous anticipation,fear
im already feeling nostalgic about the san antonio spurs golden state warriors series and it hasnt even ended yet,love
i feel like we barely know each other and time just isnt being generous with our love,love
i feel that it is vital to the conservative movement or anybody to the right of obama for that matter not hard to be to watch carefully,joy
i am definitely feeling the festive vibe and i have been busy with christmas y things mince pies are very much a british xmas goodie that i had never heard of before i met my husband well maybe in a song but other than that,joy
i feel like todays sweet treat would be something served at the north pole,joy
i really feel about affiliate marketing add to delicious a href http www,joy
i know there was just two of us but i was feeling somewhat sorry for myself and thought that i might drown my sorrows in a little salt and vinegar and a lot of batter and lard,sadness
i feel passionate about and want to convey in my stories are not suburban north america but the truths of who god is are bigger than geography,joy
i feel pretty rotten when jake takes off down the street on his hot rod mongoose and jordan strikes out trying to chase him down like an orphan straight out of a href http en,sadness
i gotta feeling da bul taewuhbeoryeo burn it up i gotta feeling niga ulbujitneun nal ah neoneun wiheomhae gal ttaekkaji gatsseo get away woooo becuz i m cuz i m dangerous b,anger
i learned what its truely like to feel and be submissive,sadness
i feel like the apothecary in romeo and juliet an unfortunate comparison perhaps,sadness
i think most people have little problem expressing but once in a while i can t help but feel that we shouldn t be afraid to let it all hang out there and express the other emotions that don t get nearly as much airtime,fear
i will cry in front of my children and feel overwhelmed without a moment s notice,surprise
i feel funny cause bonka neva thanked me fa his awards,surprise
i feel like my life has become rather dull it lacks excitement but i feel next year will be different,sadness
i just really need the money right now and i feel like some greedy nasty aunt for not wanting to hand everything over,anger
i me still feeling cold from the swim which doesnt really count as one earlier on,anger
i get on new years eve but it makes me feel rebellious being underage and all,anger
i felt so deep in my heart that that love was not lost that caresse was my way to be in touch with the rest of universe that love as hate as all the strong feelings are never vain and never lost,sadness
i pray that each of you who is hurting or feeling afraid tonight finds peace and soon,fear
i managed to eat more than i usually can on race morning mostly because jon was there and i didnt feel quite as nervous,fear
i am feeling quite pleased with myself as this was something id never done before,joy
im feeling a bit weepy today,sadness
i feel so rude i thought as i dialed my house,anger
i felt myself shrinking and feeling horrible about myself,sadness
i feel extremely discontent right now,sadness
i feeling strange energies,surprise
i feel and i was amazed to find out where papamoka shows up,surprise
i was feeling so angry so upset that i just want to run away,anger
i dont know why i feel so frantic about this but i really want to have this particular song for my little girl to be,fear
i feel very peaceful about the whole situation,joy
i was grateful for each and every one but it still made me feel funny,surprise
i still feel vulnerable around him,fear
im feeling dangerously truthful,joy
i don t feel like i have been shamed for my body but i have felt pressure to have a more socially acceptable body size,sadness
i feel smart and needed,joy
i feel that the students will be more successful in the classroom,joy
i was really upset when he went away though i can understand how he must feel and i wont be greedy and pester him about it,anger
i feel absolutely safe a,joy
i feel frustrated lonely or am having a hard time i think of elf and regain my strength lets spend together you guys and the other member for sure,anger
i feel like your child is worthless even though they passed the assessments better than anyone who applied with a college education,sadness
im feeling ok and always has a hand on me or sits very close,joy
i wasnt feeling when i got on board but its really not pleasant,joy
i can sleep on the couch or on the floor if you are still feeling shaken he offers gently,fear
i didnt get a wink of sleep that night and continued feeling not so fabulous the next morning,joy
i feel like im a hateful person sometimes,anger
i cant explain how proud of him i am and the feeling of seeing him so determined each time to win,joy
i feel that there is something valuable about herzog s study particularly as it relates to the idea of art and media influencing society and culture,joy
i feel her all around me when i am in hollywood which by the way there is a lovely girl who does marilyn on the walk of fame really great,love
i bought some three books after feeling disillusioned with the one id brought with me to glasgow,sadness
i feel very shocked by how many people i talk to who havent seen this movie,surprise
i feel very valued by my patients,joy
i have an awesome husband i got to lay in bed for two days straight which i think is directly linked to the fact that im already feeling much better,joy
im currently feeling cranky for silly reasons im now going to complain,anger
i know that this pair of socks took about two months to make but i feel that was because yours truly was truly distracted by the strings as i like to call it,anger
i also hope you understand why i feel so angry with you when you dont support the hat rule or when you turn up at a school event sans hat yourself,anger
i feel beaten up and tired mentally and physically,sadness
i feel extremely insulted,anger
i feel i am so strong enough to take this pain thinking how you did me wrong,joy
i do know how you feel if you re little apprehensive about offering your gold jewelry for your minimal more cash so i am gonna share what i found with regards to the process of selling gold jewellery for some revenue,fear
i feel so nervous anxious and i dont know why,fear
i want others to be happy but does that mean i step back yet again it feels like and allow them to be happy because they deserve it or do they even deserve it or do i,joy
i feel rotten for that but i was so mad at the whole situation i could have thrown a temper tantrum myself,sadness
im feeling lucky search means you spend less time searching for web pages and more time looking at them,joy
i also wear them when im wearing a dress that makes me feel slutty feels like those antique underwears but obviously a little bit more edgy or maybe a little bit more than a little bit,love
im kind of feeling nervous and anxious about all the shit i have to do today,fear
i feel guilty and sorry to them,sadness
i woke up feeling kinds of miserable,sadness
ive done all my usual workouts and so i feel confident that i worked hard on that front,joy
i hope that i look back on this in the future and feel glad i documented all her small ways and feel if possible even more love for her than i do now,joy
i also feels at times that i am somewhat socially isolated,sadness
i still have that feeling to you until now ya the feeling to loving you,love
ive been waiting to get some time alone for quite a few weeks now and when i finally get it im feeling a bit homesick,sadness
i would want them to know either i feel it isn t that important to know who had hurt me this much anymore,joy
im older and i adopt children if they are born gay which i do believe is a born thing feel free to discuss i shall respect that just like i will accept if they are born left handed or ginger,joy
i was capable of doing the same as of late ive been feeling pretty bitter and depressed and not a lot of gratitude in general,anger
i usually just feel aggravated with the unprofessional attitude of the rest of the cast,anger
i still feel terribly devastated,sadness
i would feel disheartened so i would then go and do cardio for another hour to achieve calories,sadness
i want them to feel as if they are intelligent and able to make their own decisions,joy
i feel uncertain about everything,fear
i hope the two of you don t feel it was all in vain,sadness
i sat on a windy beach feeling thoroughly annoyed i vowed id be back and i would climb scafell,anger
i don t always feel smart sometimes i feel lazy and i want to be doing something else that feels easier,joy
i am feeling determined that i am going to get there,joy
i feel like im back in my element and very pleased to be surrounded by adorable tiny garments,joy
i feel very weird about so much of my psychological safety coming from noah providing money,surprise
i feel resentful about my education rel bookmark why i feel resentful about my education a class entry author href http liveagainsttheflow,anger
i remember feeling bowled over and surprised by my own reaction at the tears welling up,surprise
i may be smitten or shy and i might even bat my eyelashes a few times and smile because i just cant help but feel charmed by you,joy
i feel like im over reacting by feeling so gloomy about it all,sadness
i feel like i can take on the world and even if it says no to me i wont be afraid and will not be discouraged,fear
i feel sad about it,sadness
i definitely felt scared which made me feel vulnerable and i hated that,fear
i am left feeling rejected judged and deemed inadequate,sadness
i am feeling the need to consolidate to step back and re evaluate the purpose of this blog other than providing a fabulous vicarious life for yall to live through my sarcasm does not always come across in print,joy
i feel like the addition of sweet fresh corn really adds a touch of summer to an otherwise heavy fall dish,joy
i really feel i was wronged as a patient,anger
i feel like reading anansi boys again its gorgeous,joy
i feel so dull when you re not around,sadness
i feel extremely honoured and flattered that you are turning to me for advice in this matter and hope that i can help you with your decision,joy
i feel clearer more joyful and alive,joy
i cant help but feel a bi jealous of their professional organization good support system and comfortable living situation,anger
i was left feeling discouraged and hopeless once again,sadness
i have a feeling i took so much time but kuya buddy and kuya angee have been very supportive all the way,love
im feeling fine other than normal pregnancy symptoms,joy
i completely lose ability to segregate my feelings with my actions is when they are rude and hurtful to their father and my husband who is also my hero and best friend and heart,anger
i believe him when he says it was a mistake i feel hes being sincere but i want him to be sure as to what he wants from me,joy
i set off home feeling quite smug,joy
i get these intrusive thoughts mostly violent ones or sometimes sexual the sexual ones make me feel really agitated not pleasant at all whereas the violent ones don t tend to bother me,fear
i just feel humiliated and stupid that i didnt realize that all these things were only pushing you farther away from me,sadness
i feel useless because i dont bring in any income,sadness
i was feeling so spiteful i brought it up and i saw the hurt in his face,anger
i can t help myself from feeling a bit apprehensive in the meantime,fear
i feel liked these days by both tom and myself,love
i feel at ease in those moments but the last few nights have been troubled,sadness
i feel that i can answer in a completely un sarcastic way,anger
i know when i have had a crappy day and didn t feel productive i feel lousy and sleepy in the evening,joy
i feel worthless when hes not there to pick me up at the airport,sadness
i bring you opis im feeling sashy a gorgeous cool toned grey purple lavander creme,joy
i feel what the law states suggestions is optimistic and beneficial for employees specially all those who wish to rapidly through ramadan he or she said,joy
i feel overwhelmed with the uncertainties of life the sorrows lurking about the fears eating at peoples peace the sad choices friends make the effects of those sad choices on loved ones broken relationships etc,surprise
i feel more useful to g this way,joy
i have maintained from the outset that i feel the mccanns are innocent of anything to do with the disappearance of their own daughter,joy
i feel really lucky that i m making a living doing this and i think it s important to pass the word about tap dance,joy
im now wondering if that was supposed to be a metaphor for his feelings for neal im not convinced thats the case because he seemed pretty into her but who knows,joy
i feel i was somewhat successful at not peeking at him during service the whole time,joy
i am not feeling fabulous i can now speak,joy
i feel like ive lost everything and everyone,sadness
i cant decide how i feel about some of the supporting roles particularly the girlfriend and alfred molina both quite funny but were they one dimensional caricatures or legitimate characters simply overshadowed by a fantastic lead,love
i have a feeling they don t find whiskey to be humorous over there at the health department,joy
i took part in a football match the referee was extremely partial to the opposite team this stirred up my discontent and anger,anger
i think of that image i feel calm amp safe a href http revealthestaryoutrulyare,joy
i decide to take ill still feel ive resolved a win win situation,joy
i drink into my feelings get numb,sadness
ive been procrastinating about the post birthday entry and now that its well past the fact it feels somewhat unimportant to even mention,sadness
i guess his widow was feeling generous when she packed it up,love
i was feeling pretty bitchy and horrible but dont worry,anger
i went home that day feeling very discouraged at all of the ground that i had to make up but with my heart set on fulfilling my destiny,sadness
i probably would have bailed at the half way mark when i was feeling quite low physically and mentally,sadness
i often feel that i m being submissive by not being open and honest about my desires and needs on a regular basis,sadness
i should say its giving him that sweet little feeling of being fucked,anger
i am in size now and im afrad its making me feel too complacent with myself,joy
im not enjoying winter hate feeling cold and having to dress in so many layers,anger
i feel pretty pleased about all day i was worried that perhaps i should have guessed riva but i thought that this was harvey weinstein s one big chance for a win and he s really good at helping people get oscars,joy
i feel that i was damaged by gt gt gt religion and i will not let that happen to any children of mine,sadness
i feel so humiliated at failing to achieve what i should have,sadness
i dont know why but lately i feel so dissatisfied,anger
i have a feeling david is going to turn out to be a terrific father hes already exposing his newborn son to the world of the geek,joy
i understand because of what but even towards the end when she starts going outside again i feel like she ll never be truly happy again,joy
i asked him how it felt to be under a flogger wielded by me he said it made him feel more submissive to me that he was more and more mine at least for the night,sadness
i have to do what i have to do i feel like a little kid who is being punished by her mother for something she did wrong,sadness
im feeling a craving for a naughty sweet snack this is what i choose,love
i feel unwelcome and out of place buti cant decide if i am just too scared to do anything about this ok situation or if i am staying here in this dead end situation because i am afraid things will get worse,sadness
i want to be someone that people can approach and feel accepted by and not judged because i do feel that people feel judged by me,joy
i find myself when i am feeling most alone,sadness
i am feeling pretty homesick for maine,sadness
i was like that too before i really heck care about having nice feeds and post whatever photos i feel like they only comment on cool peoples photos,joy
i feel so betrayed and humiliated,sadness
i just want to say all the things i want to say without feeling embarrassed or making other people upset,sadness
i feel each time one of my posts gets massively downvoted pagetitle rugmi popular images of the now,joy
i feel agitated about it,anger
i forgive myself that i have accepted and allowed myself to forget that i decide and thus i was decided to feel groggy this morning,sadness
i cant escape the tears of sadness and just true grief i feel at the loss of my sweet friend and sister,joy
i cant escape the tears of sadness and just true grief i feel at the loss of my sweet friend and sister,love
i cant shake the im hiding how i feel about myself beneath a fab jacket vibe and this style doesnt mesh well with most of the clothes i wear,joy
i feel sort of dazed and cross eyed,surprise
i know but it still feels very unpleasant,sadness
i feel sorry for the times that i misjudged it as well as it had to me,sadness
i am always feeling hot i am hot to the touch,love
i never want the audience to feel punished preached at or sorry for me,sadness
