Post_Text,Emotions
i feel more self assured and confident in my abilities,joy
i feel groggy and want to crawl back into be with my cat and my book,sadness
i managed a whole tuesday of eating clean but have caffeined up today and am feeling rather shaky,fear
i am feeling so low lately just feeling of hopelessness is very disturbing making me tired and sick entire of living this kind of life,sadness
i feel so honored to have been a part of this year,joy
i think of what dharavi means for mumbai and the country if you keep the annual turnovers aside for a while i feel agitated,anger
i didnt feel that it was strong enough to stop me from turning into a strawberry by the end of my holiday,joy
i would maybe come to feel special about the person given time,joy
i feel this way as this version of myself gentle gazing i realise something over and over again,love
im feeling too jaded and bitter to even bother to do a google search at this time aka tltg or too lazy to google,sadness
i feel insulted video pete edochie responds to death hoax i feel insulted a href http olajideolafunmbi,anger
i didnt feel too groggy from the wine at a href http tartandheathered,sadness
i guess she was feeling pretty hesitant,fear
i dont think thats what ill do because i feel its just really awkward,sadness
i do not feel disadvantaged or jealous without these things i feel empowered instead,sadness
i went on a bit of an auster binge after that and i remember feeling particularly fond of mr vertigo which is about a boy who learns to fly,love
i don t feel like there was a part before the race where i was stressed out,anger
i think lunch sounds datey and coffee feels casual,joy
i did feel that loving kindness allow us to think and feel how our conscious and how we interact with various things in the body and mind,love
i feel to have the honor to be this precious little girls mother,joy
i was feeling like a valued part of the family and there was a great friendly rapport between the three of us,joy
i feel so thankful i found this fantastic series to be added in my favorite series all the time,joy
i really feel like trying to be cute every day,joy
im feeling a bit melancholy for some reason so im not going to post further for now but hopefully this re discovery of my old thoughts and goals will help me to re align my focus a bit,sadness
im happy with my race pace officially and my ability to pull it together when i started feeling crappy,sadness
i feel decently intelligent,joy
im feeling the way shes not caring for me the way she used to,love
im still feeling a little hesitant but plunging in with a multitude of colored pencils nonetheless,fear
i feel like im losing grip as that fantastic avril lavigne song pops into my head,joy
i hate feeling so despised and detested by someone who i truly care for and completely love,anger
i miss time with my husband and not feeling rushed to get back home to relieve our caregiver,anger
i didnt feel she was being selfish and completely understood where she was coming from,anger
i feel passionate about sharing it with you,love
i can feel that the two girls are shocked with what i m saying,surprise
i would sometimes feel awkward talking to my brothers or mum if i dont see them for awhile,sadness
i know its only the beginning of and im already feeling fucked,anger
ive been feeling very intimidated and overwhelmed by the workload this semester and so ive just been avoiding doing what i need to,fear
i once knew a quaker who announced quite excitedly that he was feeling absolutely wonderful because for a period of about a fortnight nothing much had been happening in his brain,joy
i had an incredible feeling of frantic despair,fear
im used to being up and around until the wee hours of the morning after changeling so anyone is feeling sociable give me a call im me or stop by,joy
i told him i was feeling anxious about turning thirty,fear
i feel so foolish for resisting what was obviously meant to be,sadness
i got the feeling he was only halfway convinced,joy
i feel weird this morning,fear
i start enjoying it and it becomes part of the general fabric of feeling joyful about your everyday activities about just being,joy
i feel lucky to know what its like to revel in the freedom and wide open spaces that being by the sea affords,joy
i didnt feel the stress i was under at telstra was worth it and with out thinking i just resigned,sadness
im feeling playful google doodle of pac man game,joy
i look at your kids i feel jealous sure,anger
i was feeling quite apprehensive about my wig as i felt that it wasnt as full as id hoped it would be however id taken into account my models beautiful long hair,fear
i now feel as if im doomed to fail my upcoming global regents,sadness
i still feel a bit overwhelmed,fear
i am feeling exceptionally brave and daring i may even make the corset,joy
i feel myself getting pissed off at the tiniest things all the time,anger
i feel content without knowing the rest of their story,joy
i have been feeling less than creative and more like a sad sack,joy
i were to ever get married i d have everything ready to offer to him because i ve got it together and when i do go out to clubs even the perfect good looking guys feel intimated after talking to me about my clever self,joy
i feel so thankful to have been able to be apart of the one in the bay area,joy
i got a feeling give it up i got a feeling get away becuz i m cuz i m dangerous oh i m a badman ah,anger
i have always prayed and hoped for the universality of a single faith and a complete unconditional and voluntary feeling of brotherhood among mankind a host of beloved children of one and only heavenly father,love
i am no fan of the current president i am a conservative and it made me feel unwelcome,sadness
i got a haircut today so yes i feel handsome,joy
i feel furious about him not leaving,anger
i had a feeling you were in need of a gorgeous envy,joy
im putting it in my palm and blowing on it hoping it gets to the ears of the universe and its feeling a little generous the day it reaches them,joy
i am so proud of him and who he has become and i feel privileged to call him brother,joy
i could hardly feel my legs yet i was eager to get off the stuffy plane and quickly get out of customs,joy
i feel like the awkward year old i was and some days i really feel like a grown up,sadness
i wasn t feeling very joyful at all despite being on a caribbean island with fantastic diving learning new and exciting skills as a dive master and coaching my clients in north america all of which should bring me joy,joy
i always feel pressured to act normal with my eating around family at christmas so yeah ill need to lose weight to be comfortable eating dessert and stuff then,fear
i truly feel blessed to be sharing our first thanksgiving day together and we have many many blessings to be thankful for,joy
i feel ugly i mean i m being calle,sadness
i get a little twitchy when i feel like someone is depending on me and i have to have a flawless job done in the end,joy
i decided to see if i could locate margaret or jeff as i feel a longing to know how they are,love
i started to feel a lack of connection to my husband i m sure as a direct result of not spending much one on one time together,joy
i feel like a whore and im ashamed of,sadness
i feel getting or gifting a life time subscription is vital,joy
i want to feel useful i guess,joy
im feeling far more mellow than normal,joy
i was feeling pretty overwhelmed and stressed out over the whole affair but a few minutes of straightforward logical there totally is a right answer algebra combined with overhearing some trigonometry another tutor and tutee were working on at the library calmed me right down,surprise
i often feel real gloomy theres always another large government program on the horizon our freedoms are consistently contracted our wallets are pilfered for the benefit of fat cat corporate bankers and the public continues to vote in the politicians who steal from us every day,sadness
i have to admit i have been feeling very disheartened and disillusioned with the whole publishing community for months,sadness
i bet taylor swift basks in the knowledge that the boys she writes songs about probably feel tortured,anger
i bet taylor swift basks in the knowledge that the boys she writes songs about probably feel tortured,fear
i started trying without success to have a baby a few years back one of my pregnant acquaintances said to me my husband and i feel so relieved that we did not have to go through what you are going through we just got pregnant right away,joy
i feel so disheartened that i feel nauseous and sick,sadness
i feel like a low life mooching off everyone,sadness
im not saying cut everyone out of your life but i feel its important to find comfort in solitude meditation or working on projects alone,joy
i feel like life gave me a plenty of changes to shine and i pissed all over each and every one of them,anger
i feel a perverse pride in my self control that i managed to stay where i was ordered and not reach for the tempting human flesh so close before us,sadness
i often feel like im drowning as i try to come up with valuable content and write engaging posts,joy
im not feeling insecure this month im feeling full of oomph,fear
i feel playful today a href http www,joy
i climbed a mountain and made my way to a village where the people stared at me the children looked frightened and ran away and everyone i came across asked me why i was there in such a way as to make me feel unwelcome,sadness
i want to feel pain in my chest when something terrible happens and i want to cry happy tears when something good happens,sadness
i started sewing more garments i feel like so many popular clothing brands are so cheaply made,joy
i was taunted by the ability of feeling threatened from weakness of frailty beneath this exterior of human existance lies a woman wanting nothing but a man needing his warmth and masculinity,fear
i wear it i feel super safe and calm,joy
i get an idea something i want to write and i feel passionate about it and sculpt some great sentences,joy
ive started to delve deep into myself and evaluate everything that has made me feel insecure or unworthy,fear
i really wish i had the courage to drag a blade across my skin i wish i could do it i wish i could see the blood and feel that sweet release as it starts to pour out of my flesh and down my body,love
i sing the more confident i feel but i still get a little nervous on an opening night,fear
im stuck feeling too casual and frumpy when i return to the office,joy
i feel guilty that we will do nothing special on thanksgiving,sadness
i listen to it a feel peaceful and happy and who couldnt use a big dose of that in their lives,joy
i make some of those cracks by the age old system of not sleeping and driving myself insane but i dont have the energy and i dont have that feeling because it feels like ive already devoted my life to working and hacking systems and fucking with numbers for people,love
ive been feeling a little overwhelmed about the whole thing lately but somehow the small step of finding out where my lectures will be has helped a bit,fear
i feel so regretful that i let such mundane things as work and school get in the way,sadness
i don t feel that longing,love
i spent my vacation from school feeling confused and heartbroken,fear
i know it wouldn t have solved anything but i m sure that it would have momentarily made me feel less agitated for sure,anger
i have been feeling generally disheartened by my continually plummeting tots score despite the fact that my stats are improving so much,sadness
i have a very difficult time allowing people to do nice things for me without feeling either insulted or like i m in their debt,anger
i feel that i really need to let her know that i am still thinking of her and caring for her intense or not why not keep calling plus there is sms and im like any relationship communication is the key to keeping it alive best wishes,love
i buy books about people i feel are equally fucked up as i am or books about zen approaches to shitty situations,anger
im already feeling stressed without trying to sort that lot out,sadness
i say the feeling of being betrayed was never a pleasant feeling to begin with,joy
i think everyone should make a goal that they feel as passionate about,joy
i have to give notice to those involved that such will be a regular feature until i gain what i feel are sincere and rational responses to my enquiries particularly as i will be notifying shadow ministers of the outcome,joy
i feel that core of the song the melody should be respected as well as the lyrics but the rest can be should be changed,joy
i feel safe and happy when the house is clean,joy
i had a recent pang of feeling ugly and that i was a failure in some way,sadness
i got the feeling she really liked her new quilt,love
im feeling adventurous and my laundry hamper,joy
i have talked about it too much i feel here is a video if you are curious,surprise
ill get round to it this quarter im feeling hopeful about this one,joy
i am feeling any less submissive,sadness
as a child i suffered of nightmares even since than,fear
im feeling so unsure when things are pressing in about me comes a gentle voice so still,fear
i figure my family loves us no matter what but around anyone else i feel embarrassed when michelle goes ballistic,sadness
i felt like the most petty and spoiled person on the planet to be feeling so rotten over my luxury problems,sadness
i met a really cute girl who i feel kind of fond for today and normally girls are really complex to me but i can just be myself around her,love
im feeling especially honored as my picks feature alongside some of my favorite designers like diane von furstenberg rodarte and jason wu,joy
i got a handle on the story and it actually started to get a feel and shape that i liked,love
i tell mummy that my stomach really not feeling well i really wanna go to toilet mummy ask me keep on eating,joy
i found out on a day when i was feeling stressed and unsure of my abilities,sadness
i feel beyond ecstatic acause i can,joy
i honestly feel is almost tragic,sadness
i feel like an innocent victim i feel that i just can t win,joy
i call someone i feel like i need to at least talk a few minutes to not be rude,anger
i overslept and the hangover kicked in mid morning im still feeling extremely delicate,love
i feel anxious for myself moment of truth i feel rather like a tiger in a cage when it comes to testing,fear
i remember feeling terrified as a child,fear
im feeling mellow and am enjoying the cooler weather,joy
i get the feeling that people have died it s bothered me so much that in the past i ve cried my hair must look perfect whatever the weather all of this anxiety brings me to the end of my tether,anger
i do feel lonely at times and at times i still feel that i am alone,sadness
i do know is this i have no desire to spend my life feeling discontent so i seek a solution to the problem,sadness
i feel content sending packet after packet out into the world,joy
i feel like i am doomed for the rest of my life,sadness
im quite sore today and physically just feeling exhausted and burnt out,sadness
i love kitties and i kind of feel like spiders are underrated and over hated,sadness
i just feel like you got to pay to play sweetheart because i dont know not one person in my life that has been faithful,joy
i feel like highschool is making me unhappy,sadness
i whipped my stuff up from my station and fled to the underbelly of grand central desperate to find a subway map feeling disgusted with how upset i was over my frazzle y meltdown,anger
i will soon start to feel like me again i liked her and i miss her,love
i still feel shaky is because in the worst hit areas the damage and destruction is so complete,fear
i am feeling very inadequate about how to share my feelings and of how to write this blog post but i am going to give it a go and hope that it makes sense,sadness
i start feeling myself getting overwhelmed or frustrated i have tried to open up more about it instead of pushing it down deep slapping on a fake smile and waiting until i boil over,fear
i don t dispute that the theory has some applications i just feel that it is universalized too often and is especially abused in a culture that is accustomed to being able to control circumstances and produce a desired outcome hmmm what culture could i be referring to,sadness
i like to be comfortable and usually silence helps although at times i absolutely need music and a couple of hours off just so that i don t feel rushed,anger
i feel excited about what im doing again i feel like i have a ton of catching up to do,joy
i would buy it again because it makes me feel pretty and the smell is divine,joy
i feel like i missed out when i was younger but i was very active and would be much more content to go outside and ride a bike,sadness
i came home still feeling stunned and in need of rest i received a call from a dear elderly cousin marie to say she called an ambulance for herself and would be going to the hospital,surprise
i want every woman to feel the kind of love from god that sheri shares in her letters from the king and i am positive that she does too,joy
i feel that way about popular culture,joy
i feel apprehensive and wonder if the marks i have made in the past are still there,fear
i feel eager to tell my parents,joy
i pollution flower dew moisturising gel cream delicate luxurious and feels lovely on the skin,love
i feel very reluctant talking about death,fear
i feel that sweet pang and a desire for adventure and excitement,love
i believe even though at the time i didn t feel i should be hospitalized i m pretty sure it was a good thing i was,joy
i feel like i want to make something but the house is so messy and i am still finishing up christmas gift knitting,sadness
i am writing this at a time when i have also had an upset with the only real parent i have had almost constantly in my life and when theres no brothers and sisters around either i am an only child it feels kinda lonely,sadness
i feel very honoured to be part of our fabulous team,joy
i am feeling unsure about my words but it also means i am writing which is good,fear
i was feeling really awful by afternoon,sadness
im putting my books in a stack and wondering when ill stop feeling so sad about the passing of ray bradbury,sadness
i put these to one side and focus on the following version of the shameful revelations allegation even in an ideal egalitarian society having to reveal to the state that one is untalented would cause citizens to feel ashamed,sadness
i want to make this a daily thing i have to wash my hair every single day and that s a hassle for someone like me who has super curly hair that s a bit of a pain to straighten but when i walk out of that class i feel so good,joy
i feel overwhelmed or a little blue usually around that time of the month but i manage those feelings well,fear
i feel all kinds of excitment bacuse i really enjoy art and i hope my art will generate some talk amongst the loyal and the passerby,love
i feel like we are pressured into being young beautiful thin and depending on the trend having the girls rejuvenated or butt implants,fear
i feel very reluctant to blog during my free period even when my hp is plugged to my laptop for charging making it easy to upload photos online,fear
i cannot remember in which mix i heard this first and not remembering it is making me feeling all irritable,anger
i got out of my cab at the train station feeling firstly quite convinced that there is definitely more method in the madness of flat planet than i first thought when i visited it the day before and secondly that this had to be one of the scariest telephone interviews i ve ever conducted,joy
i feel like i ve gone a bit dull and they all agree that s the beauty of real friends they tell you when you re being stupid,sadness
i feel pressured to say something,fear
i had envisioned and intended im just feeling unsure whether i got that vision and intention right,fear
i turned in for the night feeling about as mellow as could be expected given the circumstances,joy
i have been walking around feeling pissed off at the world lately,anger
i feel dumb packing when i can t even get a straight answer about whether or not i m actually going to be able to move somewhere,sadness
i overhear the victory tune on some geeks ringtone i feel triumphant,joy
i was trying to be a friend to him so that he wouldnt feel rejected by me,sadness
i was meant to feel sympathy for her but i have little sympathy for those determined to be victims and wallow in their own pain while blaming and punishing others for their state of being,joy
i feel sooooooooper vain taking pics of myself for the last hour,sadness
i miss him and for me the fact that i have that feeling of longing to be with him again is actually a blessing,love
i suppose i felt odd and different too and liked to feel accepted even on a superficial level for an hour or two,love
i have a lot of missing information about how your previous final communication went and how you feel about this guy and what you ever liked about him but i will advise you to not be afraid of him in any way if you don t want to communicate further with him just tell him that,love
i will adjust to it but for now it feels so strange,surprise
i personally feel they are doomed to finish dead last in the nl central without this key cog to any championship team,sadness
i feel a bit optimistic some days,joy
i don t feel like i m unsuccessful when i fail at reaching a goal in my freelance writing career,sadness
i twisted that to mean that i did not have to use them if i was feeling ok,joy
i guess this isnt a very exciting story but it really meant a lot to me and made me feel less crappy about my job and less fearful of the strangers of this world because some can actually turn out to be quite nice and quite funny,sadness
i only get to see master on the weekends i feel that i am only a submissive with him during the weekends,sadness
i should stop feeling so lousy about myself,sadness
i am starting the menopause constantly suffer with mood swings temper floods of tears unable to sit for long periods and concentrate feel constantly weepy and on edge feel unable to cope with the day to tasks of ordinary life,sadness
i feel like not enough people my age actually think that most are pretty devastated that their s have come and gone,sadness
i did not care much about the number of viewers and the viewer ratings before but as the drama iris gained huge success i began to feel greedy about being successful,anger
im here to tell you you arent alone if you feel vulnerable,fear
i was actually feeling somewhat listless and unmotivated earlier this afternoon but then i had a cup of coffee medium strength coffee at that and now im bursting at the seams,sadness
in sweden,fear
i have lost touch with the things that i feel passionate about i am getting less spontaneous am living by lists urgh,joy
i feel so out of the loop and have missed alot but i am catching up,sadness
i feel whos work is worthwhile in this world and actually makes me cry,joy
i feel very vulnerable about sharing things that i write but i hit the publish button anyway,fear
i am going to feel annoyed with myself,anger
i just couldnt fall asleep feeling scared,fear
i feel like were getting married again it was so romantic and fun,love
i was still looking out for good causes that i feel passionate about to volunteer and again last year when a friend introduced me to an organization that packs food rations for needy families,love
i am so incredibly thankful for the temple and for the blessings the promises and especially the feeling that comes over me when i am either inside this amazing building or simply when i drive by,joy
i know that i feel more successful now writing a blog in my sweatpants while my baby sleeps on me than i did when i commuted on trains and ferries with a business card in the pocket of my armani blazer,joy
i feel like this was a very productive year for me in that area,joy
i feel your prick every night when you re dreaming about me and i she paused dramatically i am not impressed,surprise
i just feel stupid for not realizing what was going on sooner,sadness
i feel insecure around people who i marvel at people who humble me,fear
i aint pissed angry mad or anything i just feel pretty much fuckin insulted,anger
i feel is useful and even adding my own two cents,joy
i look like i worry that i will always feel inadequate,sadness
i am feeling stupid and stuck and i know that the best way to get it to end is just to get it to end,sadness
i feel the divine envelope me when i watch literally hundreds of faithful at mass in line for eucharist hundreds of people who include professors homeless bankers students rich poor mentally ill healthy conservatives liberals gay straight sweet rude arrogant kind,joy
im sat at work feeling pressure in my ears blowing my nose and just feeling miserable,sadness
i get bored i get scared i feel ignored i feel happy i get silly i choke on my own words i make wishes i have dreams and i still want to believe anything can happen in this world for an ordinary girl a class profile link href http www,sadness
im getting the feeling that my classes are a little intimidated by the concept of a lit,fear
i told him i was feeling unloved and underappreciated by the kids,sadness
i want someone i know to know all my thoughts and feelings or do i want to keep all my loyal and faithful readers,love
i feel which is ludicrous,sadness
i feel a little uncertain about the structure of a revalidation portfolio,fear
