Post_Text,Emotions
i will enclose her verses on her could not weigh much more thinking and feeling curious to hear the odd couple,surprise
i am already feeling anxious then how is going off my anti anxiety medicine going to help me,fear
i want her to feel humiliated and guilty,sadness
i took a chance and kept crying in hopes she might feel benevolent,joy
i feel sorry for the employees but if this is the way applebees ceo behaves its best if the chain is starved to death by caring consumers,sadness
i may be fighting a very weak argument but i feel that it is important that people do not lose the ability to listen to a true album,joy
i kind of feel lame but still dont regret coming,sadness
im overreacting or perhaps the feeling i felt was just an amplified reaction to the way she has ignored almost everything ive said in class or the stupid smile and her tone she has been using in those rare cases she hasnt ignored me,sadness
i will not consider homeschooling unless i feel we have exhausted every other option if i homeschool it will be temporary and my children will participate in non homeschooling activities as much as possible,sadness
i don t want to cry either because i know she ll think i feel tortured having to eat the black part of the rice,anger
i was feeling particularly glamorous in my charlies angel on the weekend travel outfit and comfortably passed three hours in the zoo that is gates by reading fashion mags,joy
i feel like i should be thrilled and i am but at the same time i feel like crap,joy
i feel unpleasant time is long,sadness
i hope you enjoy and do not feel offended,anger
when it became clear that a man had used many people sexually and psychologically,anger
i feel petty moaning about it but its annoying me so from now on im keeping my stuff in a bag in my room if they ask i can always say im keeping it there to stop the bathroom getting cluttered,anger
i don t feel so fearless,joy
i know i have an international audience but even now i feel pleasantly shocked that i can reach certain parts of the world,surprise
i have tryed different ways for people to notice me but i feel fake doing them because none of it is myself,sadness
i drive home i feel like a petty thief having just stolen the exposures crudely stuck in my camera from the ancients,anger
i was battling the desire to move away from her not wanting to be rude but seriously feeling disturbed by her nearness,sadness
i feel embarrassed if anyone were to stop by and see the state of my house enough that i wish i could pretend we werent even home when someone does stop by,sadness
i want to feel all year long that lovely warm tingle that october brings,love
i feel so uptight about it because i know you hate it and are constantly trying to catch glimpses of the tv in the window and listen to it,fear
i was feeling quite impressed with myself for taking just eight months to finish just the lyrics for one fairly simple though sufficiently tortured emo song,surprise
i feel that it took a lot of guts on her part and i admired her for this,love
i feel like a soda in a can shaken turbulently and flew violently out of its container the moment it felt air exchanging its freedom to you,fear
i feel smart telling people i like wally lamb because hes actually not chick lit so i always mention him so people will respect me more,joy
i get really sweaty during these episodes and my stomach will feel really funny like i m free falling,surprise
ive decided that whenever i start to feel mad about tod i dig deeper into myself to find the real solution,anger
i legitimately feel less intelligent at the end of the day because of how worthless and stupid it all is like how you feel after sitting through a michael bay movie,joy
i feel the need to turn to my beloved nations,joy
i feel so happy today me so,joy
i feel totally ungrateful and extremely lucky,sadness
i was feeling excited and motivated,joy
i do awaken from a mild night sweat i usually feel hot as if i had a fever and i want to remove some of my blankets,love
im trying to be intuitive often just makes me feel sort of confused and nauseous,fear
i am still feeling the positive effects of my visit with therapist and i feel very confident in her abilities and connections to psychologists with the necessary dr,joy
i feel like i cant afford to be afraid to show that i am sometimes weak to allow others to see me as anything less than the strong wife and mom that i feel i am,fear
i even go further these subjects are not interesting to me in anyway because i m relating to them personally some example will be used with imaginary names to protect friend and family identity s please do not feel offended if u see your name,anger
i feel is very delicate,love
i realized that when i let my mind race and i start to feel restless i get the desire to smoke,fear
i should not have to feel this way in a nerd convention i am a nerd and i should feel accepted and comfortable in that setting,love
i can t help but feel jaded,sadness
i feel tat all of us in this world are clever just depending on how u are born if u are born to be errrr not good but it will still would have some good things that u have it just that u dun realise it lol i noe its quite lame hope no one have read it img src http shared,joy
i have no idea why but i get gastric pain when i feel stressed up,anger
i feel these unwelcome guests beginning to take hold of me i will retreat to pray if but only for a moment,sadness
i feel that the pace was slowing and for a book that is rich in world building and setting up future plots this is an added bonus,joy
i dont know what guys could be doing doused in pain unless he brought a freind into it asasoulawakens i feeli am pretty loyal as part as shoots go,love
i am feeling very eager for what my darling has in store for us,joy
i mean i feel that a bgr should be treasured and not dumped like some people i know going steady having to find themselves dumped or they dump,love
i still feel tortured by feelings or thoughts or memories,fear
i do feel blamed for everything i,sadness
i feel so stupid to think they will trust me,sadness
i don t feel super strongly about it,joy
i feel honoured to be teamed with jim whom i first met about ten years ago,joy
i am feeling rather artistic and felt like sharing some of my artwork,joy
i feel ignored annotation title google bookmark img src http thequeenbuzz,sadness
i sit and remember what longing felt like and what denial feels like it is so strange to think i couldnt have changed my own perspective the experience itself created my view of the world,fear
i woke up feeling all frustrated and upset again re enacting the moment i had to succumb to the docs insults and arrogance for a favor to clarify truth about my health,anger
i lost a very dear friend in the maschke family who now wants nothing to do with me because they feel that i am unsavory or mean or cruel,sadness
i know and trust how i feel but i generally shy away from it with strangers,fear
i would probably feel much less exhausted if i had a husband who was able to come home after work and contribute to the parenting and household tasks,sadness
i had continued to think along those lines i probably would have done the dishes in anger and when he got up wed have had a fight about that with me feeling completely abused,sadness
i didnt want aubrey to feel pressured or rushed into baptism but then i realized that she doesnt need to have a perfect knowledge in order to be baptized,fear
i start to feel my feelings for him how they still rise in my heart like the submissive tide that obeys lunar whims,sadness
i feel so accepted,love
i feel their exuberance upon being accepted and i feel their pain upon being rejected,joy
i feel stressed i venture out to photograph nature in any form and that lifts my spirit,sadness
i feel slightly unimportant,sadness
i have been feeling pretty crappy,sadness
i love those ted talks i feel intimidated more than inspired because greater than great can be found in simplicity too,fear
i feel very miserable now,sadness
i sigh and say im tired and feeling very needy,sadness
i do feel amused by all the different debates going on but on the other hand i felt that theres something missing,joy
i was feeling a little nostalgic,love
i just woke up from my nap and i feel extremely agitated and grumpy,fear
i have always had people in my life who have gone out of their way to put me down trip me up or make me feel as if i were completely moronic or not worthy enough,sadness
i must say that the initial splash was not too bad but after a few strokes you could feel the cold getting into your bones,anger
i presented old work which made me feel guilty,sadness
im a little tired of writing about these things and feel like these solemn posts are a bit too much for this home school family blog,joy
i am feeling a bit restless these days,fear
i guess i feel charming and uber comfortable and i feel like a lady,joy
i feel that i ll be doomed to long pants and ugly shoes for the rest of my life and i m not even yet,sadness
i feel all ecstatic every time i see the new old opening credits on one tree hill a href http twitter,joy
i tend to err on the justice side of things and so over the past few years i feel that ive become a lot more jaded and unwilling to let god deal with people as he sees,sadness
i feel like a jaded cat whatever who doesn t ever get nervous before races because i ve just done so many and i couldn t care less,sadness
ill feel terrible in the end i dont know why i chose to continue being the shoulder for people to cry on or the one reliable person they can always turn to,sadness
i wont be so sure to feel optimistic about this either,joy
i get what williams is doing in imping other artists but i still feel that its more of a distraction than it is clever and the murder mystery plot is a decent hook but turns out to be wholly unsurprising,joy
i feel so mush freeer and less repressed,sadness
i feel so passionate and excited about my new business deer daisy,love
i feel remorseful about leaving food behind and make an effort to eat at least half of it but after stuffing myself at fruits parlor and eating this hamburger steak and all,sadness
i feel disheartened because i trust people to try to want to get to know me to not see through me and think i am boring or anything,sadness
i feel like as a creative professional you need to have that unpressed creative outlet to get re inspired,joy
i feel accepted welcomed,love
im feeling glad that we got that first show out of the way and its in the rear view mirror,joy
i feel what its like to be popular,joy
i feel like he forgets he has a faithful girlfriend back home and just parties on the weekend and acts like he s single,love
i have something to tell you girls i finally feel brave enough to share the news,joy
i have been in contact with people who are feeling extremely irritable and experiencing major headaches remotional outbursts,anger
i feel there is a really sincere pleasure to be found in pleasing others a kind of pleasure that can not be gained from anything else,joy
i feel empty and dim if i miss that,sadness
i noticed in myself that there are times when i m tired of drama tired of feeling either physically mentally emotionally or spiritually exhausted and just hope to feel my normal self again,sadness
i feel everything is in control then i am ok,joy
i had on my plate without the stress of feeling completely overwhelmed,surprise
i do feel rather nostalgic for the days gone by which will never return,love
i type this i feel like one of those unfortunate animals that gets caught in washing machines and somehow survives much lighter ragged and half dead,sadness
i feel its my job to give you perspective to at least attempt to provide context as to why seemingly intelligent folk say such unimaginable things,joy
i have my own mind and i feel like my mind is dangerous to my life,anger
i should feel contented with what ive now,joy
i feel kinda dirty like i need to shower,sadness
i could look for solutions instead of just feeling helpless actually made a big difference,fear
i feel like im the bitter old lady who has had such a long life and just cant deal with it anymore,anger
im looking forward to feeling hopeful instead of hopeless,joy
i don t believe in my weakness he is strong i don t believe i am more than a conqueror and i feel like i m a real fake and it s not fine,sadness
i feel like i am despised,anger
i feel myself caring and wondering more than them,love
i feel like my life is very rich and fulfilling but i know people look at the way i live and feel some misplaced pity for me,joy
i feel like an idiot around my friends target blank rel nofollow title friendfeed img src http dearwendy,sadness
i feel numb burn with a weak heart so i guess i must be having fun the less we say about it the better make it up as we go along feet on the ground head in the sky its ok i know nothings wrong,sadness
i feel like i am i the only one out there who is as angry as i am about suffering such loss about stupid cancer about unfairness about what is even though nothing about it is right,anger
i feel like if i m too fake with lighting you ll be taken away and not immersed in the story,sadness
i want to not feel shy with them i want to have fun with them,fear
im feeling and i say useless and he says that fucker messed with your head,sadness
i have reason to believe that my faith in trusting them has been betrayed by a lie or worse i start to doubt what my heart wants to feel this is where things get messy,sadness
i am feeling very unloved,sadness
at school,anger
im feeling pretty numb and focused on thinking about what needs to be done,sadness
i wont let me child cry it out because i feel that loving her and lily when she was little was going to be opportunities that only lasted for those short few months,love
i am thankful for not attending therapy but am really no further forward in fact probably feeling more isolated misunderstood and lonely in it,sadness
i have a feeling that i should post some sort of content on here for you blog hoppers to possibly comment about,joy
i feel distracted or scattered i take a few moments to close my eyes and just breathe,anger
ive been on a bike and this bike it feels kind of strange,fear
i ask you not to feel pressured by this,fear
i don t want to feel anything i want to be numb,sadness
i feel satisfied when i am able to translate a funny idea in my brain,joy
i used to believe that a feeling like fear was to be ignored or suppressed right away more on this in a moment,sadness
i am so very tired and feeling overwhelmed with my everyday responsibilities which brings me to the point of this post,fear
i touch your skin feeling the cool glass within an image a mere reflection of loneliness alone with myself,joy
i say it when im stressed feeling bitchy when im slacking in the toilet or when i feel constipated,anger
i kept thinking about how awesome i would feel afterwards remembering how amazing i felt after my emotional spin class the previous night,surprise
i feel like damaged goods because every time i start to really like someone i get hurt,sadness
i feel one with everything i meet even here when i return to this body out with you my beloved father indeed am beginning to realize the meaning of that unearthly love which i have sought for so long,love
i do find that this question puts me right at the edge of bringing the love of the dharma into the world an edge that i feel is vital and necessary,joy
i dont really feel his presence but im eager to hear news about him,joy
i did not really want to die but i wanted out of the pain that i was experiencing and that i was allowing others to experience by watching me and feeling helpless to do anything about it,sadness
i feel really lethargic today and just cant be bothered with much,sadness
i instantly feel rejected,sadness
i don t whoop and holler unless there s a special occasion going on but i was feeling suitably jubilant and a tad proud so out came the somewhat constipated yhhhay,joy
i didn t feel rushed to finish millions of things and i was able to focus on each task separately,anger
i really love eating fresh figs because they feel so delicate and look so much prettier than the ugly dried figs,love
i feel myself uncertain as to the next step to take,fear
i feel so comfortable around him,joy
i feel better about myself almost tasting my success,joy
i feel bitter but i want to rise up,anger
i feel uncontrollably agitated and i have no idea why,fear
i find myself often feeling isolated alone and starved for stimulating adult conversation,sadness
i was planning to make cookies this evening but i am not feeling so good so i will do this tomorrow,joy
i feel victimized by someone or something,sadness
i need to go and im feeling a longing inside at that point for him,love
i make a big deal out of yours i d like you to at least buy me a card so that i can feel special,joy
ive never thought i would feel so guilty for trying to protect someones feelings,sadness
i upload music i others like feel liked song,love
i just stayed there letting myself feel a little melancholy,sadness
i feel is superior to mine,joy
im not sure if anyone else will feel these but i was pleasantly surprised by my read of the first and second book,surprise
i plot that makes the reader feel like he is with owen morgan during his dangerous undertaking,anger
i feel there are some who still wants us together and i im being rebellious,anger
i also feel extremely blessed to be marrying into such a loving family,joy
i havent known sue anything like as long as bloater and lisa but i feel like i have you know one of those people you meet and you just click with you can have grumpy old people conversations straight away with them but then roll around laughing the next minute well thats sue,anger
i watched him run by i couldnt help but feel envious,anger
i don t feel amazing or good afterwards then i m not pleased,joy
i feel sometimes like i want to say things that i am sure will offend,joy
i also love to be complimented substantially more when i feel like i look shitty,sadness
i feel lethargic and do not really look forward to anything or take joy in anything and i kinda felt like that last night,sadness
i feel the responsibility of loving them even more,love
i may not feel hopeful and many days i do not but these truths i must call to mind the lord is my portion therefore i will hope in him,joy
im trying to do better with my spending but i feel so deprived,sadness
i feel that hallmark was sincere in their apology and am going to let it go,joy
i was on my own tearful and feeling unloved even though i know that i am,sadness
i feel lucky on my birthday,joy
i wasnt feeling well at all so had to take a few days off work lots of winter germs going round and being in an air conditioned office probably doesnt help,joy
i was pretty tired feeling a little homesick and not at all in the mood to mingle,sadness
ill talk about the feel of fake products and places i trust to shop,sadness
im not sure how i feel about him yet he seemed kind of distracted and out of it but we decided wed give him until the end of the week to prove himself to us,anger
i feel content i think,joy
i feel like valentines day should about confessing romantic love said jin hee oh an office worker shopping at lotte department store,love
i actually feel solidarity with the americans who went on to cry for blood in iraq tortured prisoners and the stripping of the bill of rights,fear
i could feel her loving gaze on me as i made my way down between her legs,love
i think all acts of unkindness are a result of some form of selfishness because being unkind requires a lack of concern for the another person and some distorted feeling of gain by being unkind,anger
i feel all numb,sadness
i feel freakishly optimistic which really runs against my natural character,joy
i feel more in control and less frightened about my headaches and migraine attacks excellent service,fear
i have been feeling rather lonely,sadness
i feel like a child who got one lick of the most delicious lollypop ever,joy
i tired of hearing of these unique communications special feelings and how sincere you are,joy
i feel simultaneously thrilled and shy about this its both unsettling and exciting to see myself in this way,joy
im feeling bitter today my mood has been strange the entire day so i guess its that,anger
i am feeling generous so you can pick any reason you like but make sure you take your wise mothers advice so i dont feel the need to drag all this to court,joy
i wrapped one child after another in a hug i realized with a sinking feeling how quickly each precious moment was passing and i was thankful that in that particular precious passing moment i was with my kids,joy
i feel slightly awful,sadness
i read her novels to make me feel relaxed,joy
i remember getting the text and feeling heartbroken,sadness
ive been medicated today but i feel funny,surprise
i wish i would feel blessed all the time and remember what i do have but for some reason it wears on me all the time and so i need that reminder through the year,love
i feel like calling them bitches but it wasnt exactly bitchy coz it wasnt intentional but i could call them ungrateful inconsiderate selfish ok ill say bitches,anger
i reflect on the past year i am feeling so blessed,joy
i took a mini break from posting pics as i just have not been feeling inspired lately,joy
i have been feeling very sad today and i dont know how to fix it,sadness
i feel triumphant so deal with it,joy
i certainly do sound like some lowdown bitch who is just countering back what people have to say but whatever it is what exactly bothers me oh well bet that hit one of their aims is that i wonder why people feel so entertained exhilarated thrilled excited when they provoke the feelings of others,joy
i see a woman sitting alone at a table in starbucks or at a restaurant if i m feeling playful and can t come up with an observation or something to say that s based on the moment i ll just sit down and say,joy
i always feel rushed on the way to visit no comments,anger
i finally left feeling judged and ridiculed because i am intelligent,joy
i think one asset that makes you guys stand out from other bands is that your musicianship especially on the latest record hits the next level and i feel this is why you are accepted in so many genres especially the hardcore scene,love
i was able to help chai lifeline with your support and encouragement is a great feeling and i am so glad you were able to help me,joy
i feel fearful because i dont know what is going to happen next in the course of me recovering,fear
im hoping to find peace with myself and in the world while still feeling the poetry of the tragic,sadness
i just feel more comfortable and i feel like im not in it alone sure he doesnt express his love much but his tiny actions make up for it,joy
i dont want to rely on a guy to pay my bills but at the same time i am a free spirit and i feel like im being punished for being a free spirit,sadness
i look back on that moment of my writing life and feel a bit ashamed that there is a part of me that wants to wrap up the everything theory series and then pack up the story ideas and call it a day,sadness
i think maybe the person gives a fake hope just because he doesnt want to show his feeling just because he is to afraid about the girl reactions,fear
im feeling pissed and sad right now,anger
i felt empowered telling him how it had affected me how i had come close to suicide because of the severe distress it had caused me to continue to feel long after the unpleasant encounter where what i felt was disregarded completely,sadness
i feel im being punished for not being able to do my dailies,sadness
i dint feel any strong pain yet just cramping which comes and go like what i used to have during menses,joy
i feel paranoid like we just stepped into a private club where everyone knows each other and we are standing out like nudists at a suit convention,fear
i got to chat with rustie dean from my hometown moose jaw and everyone made me feel so welcomed and comfortable,joy
i feel way when meet again i ll ask you re doing and you ll say fine ask i m doing and i ll lie i ll say ordinary it s ordinary day,joy
ive become anxious about in recent times is this there is certainly a feeling amongst some people of belief that they are under siege that they are often disadvantaged that they are looked at and considered in some way different and their faith makes them less worthy of regard he said,sadness
im a lover and a listener i just cuddle and listen and i cant do the cuddle thing so i feel a bit listless,sadness
i feel that i have often entertained people by not saying what came to my mind in that moment and instead by making up stories or adding some extras especially because,joy
i start feeling mournful,sadness
i feel this command is useful to check the free space in log file for all databases in over go,joy
i wrote last year when i was feeling more dull and inarticulate than normal,sadness
i am too dazed confused and too drowned in what women looks for looks wise in a man and feel that i am doomed if i can t aspire to these,sadness
i was overwhelmed by the feeling of being impressed i think these kids theyre years younger than me i can call them kids right,surprise
i feel we do have some control over our petty dissatisfactions by trying to act or think and then feel more positive about our own lives,anger
i feel equally wronged,anger
i like to feel respected by a guy i m with not abused,joy
i hope you can feel that and will take the time to feel tender about your life for a moment,love
